W4: Goal Count:
Y6: =[summary.xls]MASTER!$F$1 -> 145
P12: Last updated on:
T13: Upcoming Match Predictions
P14: =TODAY() -> 40370 | R14: =NOW() -> 40370.841809837963
K16: RANK | L16: PARTICIPANT | N16: TOTAL POINTS | O16: Group Stage Points | P16: Bracket Stage Points | Q16: Lucky-7 Bonus Points | R16: Possible Points Remaining
K18: =RANK(N18,$N$18:$N$98,0) -> 1 | L18: CharlesLan | N18: =[summary.xls]CharlesLan!$E$173 -> 128 | O18: =[summary.xls]CharlesLan!$F$69 -> 41 | P18: =[summary.xls]CharlesLan!$F$148 -> 57 | Q18: =[summary.xls]CharlesLan!$F$168 -> 30 | R18: 0 | T18: =VLOOKUP($L18,[summary.xls]MASTER!$F$8:$BF$88,46,TRUE) ->  | U18: =VLOOKUP($L18,[summary.xls]MASTER!$F$8:$BF$88,47,TRUE) ->  | Z18: =VLOOKUP($L18,[summary.xls]MASTER!$F$8:$BF$88,50,TRUE) ->  | AA18: =VLOOKUP($L18,[summary.xls]MASTER!$F$8:$BF$88,51,TRUE) ->  | AC18: =VLOOKUP($L18,[summary.xls]MASTER!$F$8:$BF$88,52,TRUE) ->  | AD18: =VLOOKUP($L18,[summary.xls]MASTER!$F$8:$BF$88,53,TRUE) -> 
K19: =RANK(N19,$N$18:$N$98,0) -> 2 | L19: Luis | N19: =[summary.xls]Luis!$E$173 -> 114 | O19: =[summary.xls]Luis!$F$69 -> 40 | P19: =[summary.xls]Luis!$F$148 -> 49 | Q19: =[summary.xls]Luis!$F$168 -> 25 | R19: 0 | T19: =VLOOKUP($L19,[summary.xls]MASTER!$F$8:$BF$88,46,TRUE) ->  | U19: =VLOOKUP($L19,[summary.xls]MASTER!$F$8:$BF$88,47,TRUE) ->  | Z19: =VLOOKUP($L19,[summary.xls]MASTER!$F$8:$BF$88,50,TRUE) ->  | AA19: =VLOOKUP($L19,[summary.xls]MASTER!$F$8:$BF$88,51,TRUE) ->  | AC19: =VLOOKUP($L19,[summary.xls]MASTER!$F$8:$BF$88,52,TRUE) ->  | AD19: =VLOOKUP($L19,[summary.xls]MASTER!$F$8:$BF$88,53,TRUE) -> 
K20: =RANK(N20,$N$18:$N$98,0) -> 3 | L20: Dermit | N20: =[summary.xls]Dermit!$E$173 -> 103 | O20: =[summary.xls]Dermit!$F$69 -> 39 | P20: =[summary.xls]Dermit!$F$148 -> 59 | Q20: =[summary.xls]Dermit!$F$168 -> 5 | R20: 0 | T20: =VLOOKUP($L20,[summary.xls]MASTER!$F$8:$BF$88,46,TRUE) ->  | U20: =VLOOKUP($L20,[summary.xls]MASTER!$F$8:$BF$88,47,TRUE) ->  | Z20: =VLOOKUP($L20,[summary.xls]MASTER!$F$8:$BF$88,50,TRUE) ->  | AA20: =VLOOKUP($L20,[summary.xls]MASTER!$F$8:$BF$88,51,TRUE) -> 
K21: =RANK(N21,$N$18:$N$98,0) -> 3 | L21: Anthony | N21: =[summary.xls]Anthony!$E$173 -> 103 | O21: =[summary.xls]Anthony!$F$69 -> 43 | P21: =[summary.xls]Anthony!$F$148 -> 40 | Q21: =[summary.xls]Anthony!$F$168 -> 20 | R21: 0 | T21: =VLOOKUP($L21,[summary.xls]MASTER!$F$8:$BF$88,46,TRUE) ->  | U21: =VLOOKUP($L21,[summary.xls]MASTER!$F$8:$BF$88,47,TRUE) ->  | W21: =VLOOKUP($L21,[summary.xls]MASTER!$F$8:$BF$88,48,TRUE) ->  | X21: =VLOOKUP($L21,[summary.xls]MASTER!$F$8:$BF$88,49,TRUE) ->  | Z21: =VLOOKUP($L21,[summary.xls]MASTER!$F$8:$BF$88,50,TRUE) ->  | AA21: =VLOOKUP($L21,[summary.xls]MASTER!$F$8:$BF$88,51,TRUE) ->  | AC21: =VLOOKUP($L21,[summary.xls]MASTER!$F$8:$BF$88,52,TRUE) ->  | AD21: =VLOOKUP($L21,[summary.xls]MASTER!$F$8:$BF$88,53,TRUE) -> 
K22: =RANK(N22,$N$18:$N$98,0) -> 5 | L22: Rob | N22: =[summary.xls]Rob!$E$173 -> 102 | O22: =[summary.xls]Rob!$F$69 -> 36 | P22: =[summary.xls]Rob!$F$148 -> 51 | Q22: =[summary.xls]Rob!$F$168 -> 15 | R22: 0 | T22: =VLOOKUP($L22,[summary.xls]MASTER!$F$8:$BF$88,46,TRUE) ->  | U22: =VLOOKUP($L22,[summary.xls]MASTER!$F$8:$BF$88,47,TRUE) ->  | Z22: =VLOOKUP($L22,[summary.xls]MASTER!$F$8:$BF$88,50,TRUE) ->  | AA22: =VLOOKUP($L22,[summary.xls]MASTER!$F$8:$BF$88,51,TRUE) ->  | AC22: =VLOOKUP($L22,[summary.xls]MASTER!$F$8:$BF$88,52,TRUE) ->  | AD22: =VLOOKUP($L22,[summary.xls]MASTER!$F$8:$BF$88,53,TRUE) -> 
K23: =RANK(N23,$N$18:$N$98,0) -> 6 | L23: Stephen | N23: =[summary.xls]Stephen!$E$173 -> 96 | O23: =[summary.xls]Stephen!$F$69 -> 40 | P23: =[summary.xls]Stephen!$F$148 -> 46 | Q23: =[summary.xls]Stephen!$F$168 -> 10 | R23: 0 | T23: =VLOOKUP($L23,[summary.xls]MASTER!$F$8:$BF$88,46,TRUE) ->  | U23: =VLOOKUP($L23,[summary.xls]MASTER!$F$8:$BF$88,47,TRUE) ->  | W23: =VLOOKUP($L23,[summary.xls]MASTER!$F$8:$BF$88,48,TRUE) ->  | X23: =VLOOKUP($L23,[summary.xls]MASTER!$F$8:$BF$88,49,TRUE) ->  | Z23: =VLOOKUP($L23,[summary.xls]MASTER!$F$8:$BF$88,50,TRUE) ->  | AA23: =VLOOKUP($L23,[summary.xls]MASTER!$F$8:$BF$88,51,TRUE) ->  | AC23: =VLOOKUP($L23,[summary.xls]MASTER!$F$8:$BF$88,52,TRUE) ->  | AD23: =VLOOKUP($L23,[summary.xls]MASTER!$F$8:$BF$88,53,TRUE) -> 
K24: =RANK(N24,$N$18:$N$98,0) -> 7 | L24: Dan | N24: =[summary.xls]Dan!$E$173 -> 95 | O24: =[summary.xls]Dan!$F$69 -> 42 | P24: =[summary.xls]Dan!$F$148 -> 48 | Q24: =[summary.xls]Dan!$F$168 -> 5 | R24: 0 | T24: =VLOOKUP($L24,[summary.xls]MASTER!$F$8:$BF$88,46,TRUE) ->  | U24: =VLOOKUP($L24,[summary.xls]MASTER!$F$8:$BF$88,47,TRUE) ->  | Z24: =VLOOKUP($L24,[summary.xls]MASTER!$F$8:$BF$88,50,TRUE) ->  | AA24: =VLOOKUP($L24,[summary.xls]MASTER!$F$8:$BF$88,51,TRUE) ->  | AC24: =VLOOKUP($L24,[summary.xls]MASTER!$F$8:$BF$88,52,TRUE) ->  | AD24: =VLOOKUP($L24,[summary.xls]MASTER!$F$8:$BF$88,53,TRUE) -> 
K25: =RANK(N25,$N$18:$N$98,0) -> 8 | L25: Joseph | N25: =[summary.xls]Joseph!$E$173 -> 93 | O25: =[summary.xls]Joseph!$F$69 -> 43 | P25: =[summary.xls]Joseph!$F$148 -> 30 | Q25: =[summary.xls]Joseph!$F$168 -> 20 | R25: 0 | T25: =VLOOKUP($L25,[summary.xls]MASTER!$F$8:$BF$88,46,TRUE) ->  | U25: =VLOOKUP($L25,[summary.xls]MASTER!$F$8:$BF$88,47,TRUE) ->  | W25: =VLOOKUP($L25,[summary.xls]MASTER!$F$8:$BF$88,48,TRUE) ->  | X25: =VLOOKUP($L25,[summary.xls]MASTER!$F$8:$BF$88,49,TRUE) ->  | Z25: =VLOOKUP($L25,[summary.xls]MASTER!$F$8:$BF$88,50,TRUE) ->  | AA25: =VLOOKUP($L25,[summary.xls]MASTER!$F$8:$BF$88,51,TRUE) ->  | AC25: =VLOOKUP($L25,[summary.xls]MASTER!$F$8:$BF$88,52,TRUE) ->  | AD25: =VLOOKUP($L25,[summary.xls]MASTER!$F$8:$BF$88,53,TRUE) -> 
K26: =RANK(N26,$N$18:$N$98,0) -> 8 | L26: Nancy | N26: =[summary.xls]Nancy!$E$173 -> 93 | O26: =[summary.xls]Nancy!$F$69 -> 35 | P26: =[summary.xls]Nancy!$F$148 -> 53 | Q26: =[summary.xls]Nancy!$F$168 -> 5 | R26: 0 | T26: =VLOOKUP($L26,[summary.xls]MASTER!$F$8:$BF$88,46,TRUE) ->  | U26: =VLOOKUP($L26,[summary.xls]MASTER!$F$8:$BF$88,47,TRUE) ->  | Z26: =VLOOKUP($L26,[summary.xls]MASTER!$F$8:$BF$88,50,TRUE) ->  | AA26: =VLOOKUP($L26,[summary.xls]MASTER!$F$8:$BF$88,51,TRUE) ->  | AC26: =VLOOKUP($L26,[summary.xls]MASTER!$F$8:$BF$88,52,TRUE) ->  | AD26: =VLOOKUP($L26,[summary.xls]MASTER!$F$8:$BF$88,53,TRUE) -> 
K27: =RANK(N27,$N$18:$N$98,0) -> 10 | L27: Danny1 | N27: =[summary.xls]Danny1!$E$173 -> 92 | O27: =[summary.xls]Danny1!$F$69 -> 36 | P27: =[summary.xls]Danny1!$F$148 -> 41 | Q27: =[summary.xls]Danny1!$F$168 -> 15 | R27: 0 | T27: =VLOOKUP($L27,[summary.xls]MASTER!$F$8:$BF$88,46,TRUE) ->  | U27: =VLOOKUP($L27,[summary.xls]MASTER!$F$8:$BF$88,47,TRUE) ->  | W27: =VLOOKUP($L27,[summary.xls]MASTER!$F$8:$BF$88,48,TRUE) ->  | X27: =VLOOKUP($L27,[summary.xls]MASTER!$F$8:$BF$88,49,TRUE) ->  | Z27: =VLOOKUP($L27,[summary.xls]MASTER!$F$8:$BF$88,50,TRUE) ->  | AA27: =VLOOKUP($L27,[summary.xls]MASTER!$F$8:$BF$88,51,TRUE) ->  | AC27: =VLOOKUP($L27,[summary.xls]MASTER!$F$8:$BF$88,52,TRUE) ->  | AD27: =VLOOKUP($L27,[summary.xls]MASTER!$F$8:$BF$88,53,TRUE) -> 
K28: =RANK(N28,$N$18:$N$98,0) -> 11 | L28: AshK | N28: =[summary.xls]AshK!$E$173 -> 90 | O28: =[summary.xls]AshK!$F$69 -> 36 | P28: =[summary.xls]AshK!$F$148 -> 44 | Q28: =[summary.xls]AshK!$F$168 -> 10 | R28: 0 | T28: =VLOOKUP($L28,[summary.xls]MASTER!$F$8:$BF$88,46,TRUE) ->  | U28: =VLOOKUP($L28,[summary.xls]MASTER!$F$8:$BF$88,47,TRUE) ->  | Z28: =VLOOKUP($L28,[summary.xls]MASTER!$F$8:$BF$88,50,TRUE) ->  | AA28: =VLOOKUP($L28,[summary.xls]MASTER!$F$8:$BF$88,51,TRUE) ->  | AC28: =VLOOKUP($L28,[summary.xls]MASTER!$F$8:$BF$88,52,TRUE) ->  | AD28: =VLOOKUP($L28,[summary.xls]MASTER!$F$8:$BF$88,53,TRUE) -> 
K29: =RANK(N29,$N$18:$N$98,0) -> 12 | L29: Caroline | N29: =[summary.xls]Caroline!$E$173 -> 87 | O29: =[summary.xls]Caroline!$F$69 -> 38 | P29: =[summary.xls]Caroline!$F$148 -> 44 | Q29: =[summary.xls]Caroline!$F$168 -> 5 | R29: 0 | T29: =VLOOKUP($L29,[summary.xls]MASTER!$F$8:$BF$88,46,TRUE) ->  | U29: =VLOOKUP($L29,[summary.xls]MASTER!$F$8:$BF$88,47,TRUE) ->  | W29: =VLOOKUP($L29,[summary.xls]MASTER!$F$8:$BF$88,48,TRUE) ->  | X29: =VLOOKUP($L29,[summary.xls]MASTER!$F$8:$BF$88,49,TRUE) ->  | Z29: =VLOOKUP($L29,[summary.xls]MASTER!$F$8:$BF$88,50,TRUE) ->  | AA29: =VLOOKUP($L29,[summary.xls]MASTER!$F$8:$BF$88,51,TRUE) -> 
K30: =RANK(N30,$N$18:$N$98,0) -> 12 | L30: Gustavo | N30: =[summary.xls]Gustavo!$E$173 -> 87 | O30: =[summary.xls]Gustavo!$F$69 -> 38 | P30: =[summary.xls]Gustavo!$F$148 -> 34 | Q30: =[summary.xls]Gustavo!$F$168 -> 15 | R30: 0 | T30: =VLOOKUP($L30,[summary.xls]MASTER!$F$8:$BF$88,46,TRUE) ->  | U30: =VLOOKUP($L30,[summary.xls]MASTER!$F$8:$BF$88,47,TRUE) ->  | W30: =VLOOKUP($L30,[summary.xls]MASTER!$F$8:$BF$88,48,TRUE) ->  | X30: =VLOOKUP($L30,[summary.xls]MASTER!$F$8:$BF$88,49,TRUE) ->  | Z30: =VLOOKUP($L30,[summary.xls]MASTER!$F$8:$BF$88,50,TRUE) ->  | AA30: =VLOOKUP($L30,[summary.xls]MASTER!$F$8:$BF$88,51,TRUE) ->  | AC30: =VLOOKUP($L30,[summary.xls]MASTER!$F$8:$BF$88,52,TRUE) ->  | AD30: =VLOOKUP($L30,[summary.xls]MASTER!$F$8:$BF$88,53,TRUE) -> 
K31: =RANK(N31,$N$18:$N$98,0) -> 14 | L31: Simon | N31: =[summary.xls]Simon!$E$173 -> 86 | O31: =[summary.xls]Simon!$F$69 -> 40 | P31: =[summary.xls]Simon!$F$148 -> 31 | Q31: =[summary.xls]Simon!$F$168 -> 15 | R31: 0 | T31: =VLOOKUP($L31,[summary.xls]MASTER!$F$8:$BF$88,46,TRUE) ->  | U31: =VLOOKUP($L31,[summary.xls]MASTER!$F$8:$BF$88,47,TRUE) ->  | W31: =VLOOKUP($L31,[summary.xls]MASTER!$F$8:$BF$88,48,TRUE) ->  | X31: =VLOOKUP($L31,[summary.xls]MASTER!$F$8:$BF$88,49,TRUE) ->  | Z31: =VLOOKUP($L31,[summary.xls]MASTER!$F$8:$BF$88,50,TRUE) ->  | AA31: =VLOOKUP($L31,[summary.xls]MASTER!$F$8:$BF$88,51,TRUE) ->  | AC31: =VLOOKUP($L31,[summary.xls]MASTER!$F$8:$BF$88,52,TRUE) ->  | AD31: =VLOOKUP($L31,[summary.xls]MASTER!$F$8:$BF$88,53,TRUE) -> 
K32: =RANK(N32,$N$18:$N$98,0) -> 14 | L32: CarlosG | N32: =[summary.xls]CarlosG!$E$173 -> 86 | O32: =[summary.xls]CarlosG!$F$69 -> 30 | P32: =[summary.xls]CarlosG!$F$148 -> 36 | Q32: =[summary.xls]CarlosG!$F$168 -> 20 | R32: 0 | T32: =VLOOKUP($L32,[summary.xls]MASTER!$F$8:$BF$88,46,TRUE) ->  | U32: =VLOOKUP($L32,[summary.xls]MASTER!$F$8:$BF$88,47,TRUE) ->  | W32: =VLOOKUP($L32,[summary.xls]MASTER!$F$8:$BF$88,48,TRUE) ->  | X32: =VLOOKUP($L32,[summary.xls]MASTER!$F$8:$BF$88,49,TRUE) ->  | Z32: =VLOOKUP($L32,[summary.xls]MASTER!$F$8:$BF$88,50,TRUE) ->  | AA32: =VLOOKUP($L32,[summary.xls]MASTER!$F$8:$BF$88,51,TRUE) ->  | AC32: =VLOOKUP($L32,[summary.xls]MASTER!$F$8:$BF$88,52,TRUE) ->  | AD32: =VLOOKUP($L32,[summary.xls]MASTER!$F$8:$BF$88,53,TRUE) -> 
K33: =RANK(N33,$N$18:$N$98,0) -> 16 | L33: Henry | N33: =[summary.xls]Henry!$E$173 -> 84 | O33: =[summary.xls]Henry!$F$69 -> 43 | P33: =[summary.xls]Henry!$F$148 -> 31 | Q33: =[summary.xls]Henry!$F$168 -> 10 | R33: 0 | T33: =VLOOKUP($L33,[summary.xls]MASTER!$F$8:$BF$88,46,TRUE) ->  | U33: =VLOOKUP($L33,[summary.xls]MASTER!$F$8:$BF$88,47,TRUE) ->  | W33: =VLOOKUP($L33,[summary.xls]MASTER!$F$8:$BF$88,48,TRUE) ->  | X33: =VLOOKUP($L33,[summary.xls]MASTER!$F$8:$BF$88,49,TRUE) ->  | Z33: =VLOOKUP($L33,[summary.xls]MASTER!$F$8:$BF$88,50,TRUE) ->  | AA33: =VLOOKUP($L33,[summary.xls]MASTER!$F$8:$BF$88,51,TRUE) ->  | AC33: =VLOOKUP($L33,[summary.xls]MASTER!$F$8:$BF$88,52,TRUE) ->  | AD33: =VLOOKUP($L33,[summary.xls]MASTER!$F$8:$BF$88,53,TRUE) -> 
K34: =RANK(N34,$N$18:$N$98,0) -> 16 | L34: Brian2 | N34: =[summary.xls]Brian2!$E$173 -> 84 | O34: =[summary.xls]Brian2!$F$69 -> 40 | P34: =[summary.xls]Brian2!$F$148 -> 39 | Q34: =[summary.xls]Brian2!$F$168 -> 5 | R34: 0 | T34: =VLOOKUP($L34,[summary.xls]MASTER!$F$8:$BF$88,46,TRUE) ->  | U34: =VLOOKUP($L34,[summary.xls]MASTER!$F$8:$BF$88,47,TRUE) ->  | W34: =VLOOKUP($L34,[summary.xls]MASTER!$F$8:$BF$88,48,TRUE) ->  | X34: =VLOOKUP($L34,[summary.xls]MASTER!$F$8:$BF$88,49,TRUE) ->  | Z34: =VLOOKUP($L34,[summary.xls]MASTER!$F$8:$BF$88,50,TRUE) ->  | AA34: =VLOOKUP($L34,[summary.xls]MASTER!$F$8:$BF$88,51,TRUE) ->  | AC34: =VLOOKUP($L34,[summary.xls]MASTER!$F$8:$BF$88,52,TRUE) ->  | AD34: =VLOOKUP($L34,[summary.xls]MASTER!$F$8:$BF$88,53,TRUE) -> 
K35: =RANK(N35,$N$18:$N$98,0) -> 18 | L35: Vito | N35: =[summary.xls]Vito!$E$173 -> 83 | O35: =[summary.xls]Vito!$F$69 -> 42 | P35: =[summary.xls]Vito!$F$148 -> 21 | Q35: =[summary.xls]Vito!$F$168 -> 20 | R35: 0 | T35: =VLOOKUP($L35,[summary.xls]MASTER!$F$8:$BF$88,46,TRUE) ->  | U35: =VLOOKUP($L35,[summary.xls]MASTER!$F$8:$BF$88,47,TRUE) ->  | W35: =VLOOKUP($L35,[summary.xls]MASTER!$F$8:$BF$88,48,TRUE) ->  | X35: =VLOOKUP($L35,[summary.xls]MASTER!$F$8:$BF$88,49,TRUE) ->  | Z35: =VLOOKUP($L35,[summary.xls]MASTER!$F$8:$BF$88,50,TRUE) ->  | AA35: =VLOOKUP($L35,[summary.xls]MASTER!$F$8:$BF$88,51,TRUE) ->  | AC35: =VLOOKUP($L35,[summary.xls]MASTER!$F$8:$BF$88,52,TRUE) ->  | AD35: =VLOOKUP($L35,[summary.xls]MASTER!$F$8:$BF$88,53,TRUE) -> 
K36: =RANK(N36,$N$18:$N$98,0) -> 18 | L36: Robin | N36: =[summary.xls]Robin!$E$173 -> 83 | O36: =[summary.xls]Robin!$F$69 -> 33 | P36: =[summary.xls]Robin!$F$148 -> 45 | Q36: =[summary.xls]Robin!$F$168 -> 5 | R36: 0 | T36: =VLOOKUP($L36,[summary.xls]MASTER!$F$8:$BF$88,46,TRUE) ->  | U36: =VLOOKUP($L36,[summary.xls]MASTER!$F$8:$BF$88,47,TRUE) ->  | Z36: =VLOOKUP($L36,[summary.xls]MASTER!$F$8:$BF$88,50,TRUE) ->  | AA36: =VLOOKUP($L36,[summary.xls]MASTER!$F$8:$BF$88,51,TRUE) ->  | AC36: =VLOOKUP($L36,[summary.xls]MASTER!$F$8:$BF$88,52,TRUE) ->  | AD36: =VLOOKUP($L36,[summary.xls]MASTER!$F$8:$BF$88,53,TRUE) -> 
K37: =RANK(N37,$N$18:$N$98,0) -> 20 | L37: Cleo | N37: =[summary.xls]Cleo!$E$173 -> 82 | O37: =[summary.xls]Cleo!$F$69 -> 32 | P37: =[summary.xls]Cleo!$F$148 -> 45 | Q37: =[summary.xls]Cleo!$F$168 -> 5 | R37: 0 | T37: =VLOOKUP($L37,[summary.xls]MASTER!$F$8:$BF$88,46,TRUE) ->  | U37: =VLOOKUP($L37,[summary.xls]MASTER!$F$8:$BF$88,47,TRUE) ->  | W37: =VLOOKUP($L37,[summary.xls]MASTER!$F$8:$BF$88,48,TRUE) ->  | X37: =VLOOKUP($L37,[summary.xls]MASTER!$F$8:$BF$88,49,TRUE) ->  | Z37: =VLOOKUP($L37,[summary.xls]MASTER!$F$8:$BF$88,50,TRUE) ->  | AA37: =VLOOKUP($L37,[summary.xls]MASTER!$F$8:$BF$88,51,TRUE) -> 
K38: =RANK(N38,$N$18:$N$98,0) -> 20 | L38: CarlosS | N38: =[summary.xls]CarlosS!$E$173 -> 82 | O38: =[summary.xls]CarlosS!$F$69 -> 31 | P38: =[summary.xls]CarlosS!$F$148 -> 46 | Q38: =[summary.xls]CarlosS!$F$168 -> 5 | R38: 0 | T38: =VLOOKUP($L38,[summary.xls]MASTER!$F$8:$BF$88,46,TRUE) ->  | U38: =VLOOKUP($L38,[summary.xls]MASTER!$F$8:$BF$88,47,TRUE) ->  | Z38: =VLOOKUP($L38,[summary.xls]MASTER!$F$8:$BF$88,50,TRUE) ->  | AA38: =VLOOKUP($L38,[summary.xls]MASTER!$F$8:$BF$88,51,TRUE) ->  | AC38: =VLOOKUP($L38,[summary.xls]MASTER!$F$8:$BF$88,52,TRUE) ->  | AD38: =VLOOKUP($L38,[summary.xls]MASTER!$F$8:$BF$88,53,TRUE) -> 
K39: =RANK(N39,$N$18:$N$98,0) -> 20 | L39: Migus | N39: =[summary.xls]Migus!$E$173 -> 82 | O39: =[summary.xls]Migus!$F$69 -> 29 | P39: =[summary.xls]Migus!$F$148 -> 38 | Q39: =[summary.xls]Migus!$F$168 -> 15 | R39: 0 | T39: =VLOOKUP($L39,[summary.xls]MASTER!$F$8:$BF$88,46,TRUE) ->  | U39: =VLOOKUP($L39,[summary.xls]MASTER!$F$8:$BF$88,47,TRUE) ->  | W39: =VLOOKUP($L39,[summary.xls]MASTER!$F$8:$BF$88,48,TRUE) ->  | X39: =VLOOKUP($L39,[summary.xls]MASTER!$F$8:$BF$88,49,TRUE) ->  | Z39: =VLOOKUP($L39,[summary.xls]MASTER!$F$8:$BF$88,50,TRUE) ->  | AA39: =VLOOKUP($L39,[summary.xls]MASTER!$F$8:$BF$88,51,TRUE) ->  | AC39: =VLOOKUP($L39,[summary.xls]MASTER!$F$8:$BF$88,52,TRUE) ->  | AD39: =VLOOKUP($L39,[summary.xls]MASTER!$F$8:$BF$88,53,TRUE) -> 
K40: =RANK(N40,$N$18:$N$98,0) -> 23 | L40: Tyrone | N40: =[summary.xls]Tyrone!$E$173 -> 81 | O40: =[summary.xls]Tyrone!$F$69 -> 38 | P40: =[summary.xls]Tyrone!$F$148 -> 23 | Q40: =[summary.xls]Tyrone!$F$168 -> 20 | R40: 0 | T40: =VLOOKUP($L40,[summary.xls]MASTER!$F$8:$BF$88,46,TRUE) ->  | U40: =VLOOKUP($L40,[summary.xls]MASTER!$F$8:$BF$88,47,TRUE) ->  | W40: =VLOOKUP($L40,[summary.xls]MASTER!$F$8:$BF$88,48,TRUE) ->  | X40: =VLOOKUP($L40,[summary.xls]MASTER!$F$8:$BF$88,49,TRUE) ->  | Z40: =VLOOKUP($L40,[summary.xls]MASTER!$F$8:$BF$88,50,TRUE) ->  | AA40: =VLOOKUP($L40,[summary.xls]MASTER!$F$8:$BF$88,51,TRUE) ->  | AC40: =VLOOKUP($L40,[summary.xls]MASTER!$F$8:$BF$88,52,TRUE) ->  | AD40: =VLOOKUP($L40,[summary.xls]MASTER!$F$8:$BF$88,53,TRUE) -> 
K41: =RANK(N41,$N$18:$N$98,0) -> 23 | L41: Edward | N41: =[summary.xls]Edward!$E$173 -> 81 | O41: =[summary.xls]Edward!$F$69 -> 35 | P41: =[summary.xls]Edward!$F$148 -> 41 | Q41: =[summary.xls]Edward!$F$168 -> 5 | R41: 0 | T41: =VLOOKUP($L41,[summary.xls]MASTER!$F$8:$BF$88,46,TRUE) ->  | U41: =VLOOKUP($L41,[summary.xls]MASTER!$F$8:$BF$88,47,TRUE) ->  | W41: =VLOOKUP($L41,[summary.xls]MASTER!$F$8:$BF$88,48,TRUE) ->  | X41: =VLOOKUP($L41,[summary.xls]MASTER!$F$8:$BF$88,49,TRUE) ->  | Z41: =VLOOKUP($L41,[summary.xls]MASTER!$F$8:$BF$88,50,TRUE) ->  | AA41: =VLOOKUP($L41,[summary.xls]MASTER!$F$8:$BF$88,51,TRUE) ->  | AC41: =VLOOKUP($L41,[summary.xls]MASTER!$F$8:$BF$88,52,TRUE) ->  | AD41: =VLOOKUP($L41,[summary.xls]MASTER!$F$8:$BF$88,53,TRUE) -> 
K42: =RANK(N42,$N$18:$N$98,0) -> 23 | L42: Danielle | N42: =[summary.xls]Danielle!$E$173 -> 81 | O42: =[summary.xls]Danielle!$F$69 -> 33 | P42: =[summary.xls]Danielle!$F$148 -> 38 | Q42: =[summary.xls]Danielle!$F$168 -> 10 | R42: 0 | T42: =VLOOKUP($L42,[summary.xls]MASTER!$F$8:$BF$88,46,TRUE) ->  | U42: =VLOOKUP($L42,[summary.xls]MASTER!$F$8:$BF$88,47,TRUE) ->  | W42: =VLOOKUP($L42,[summary.xls]MASTER!$F$8:$BF$88,48,TRUE) ->  | X42: =VLOOKUP($L42,[summary.xls]MASTER!$F$8:$BF$88,49,TRUE) ->  | Z42: =VLOOKUP($L42,[summary.xls]MASTER!$F$8:$BF$88,50,TRUE) ->  | AA42: =VLOOKUP($L42,[summary.xls]MASTER!$F$8:$BF$88,51,TRUE) ->  | AC42: =VLOOKUP($L42,[summary.xls]MASTER!$F$8:$BF$88,52,TRUE) ->  | AD42: =VLOOKUP($L42,[summary.xls]MASTER!$F$8:$BF$88,53,TRUE) -> 
K43: =RANK(N43,$N$18:$N$98,0) -> 26 | L43: Eyal | N43: =[summary.xls]Eyal!$E$173 -> 80 | O43: =[summary.xls]Eyal!$F$69 -> 42 | P43: =[summary.xls]Eyal!$F$148 -> 33 | Q43: =[summary.xls]Eyal!$F$168 -> 5 | R43: 0 | T43: =VLOOKUP($L43,[summary.xls]MASTER!$F$8:$BF$88,46,TRUE) ->  | U43: =VLOOKUP($L43,[summary.xls]MASTER!$F$8:$BF$88,47,TRUE) ->  | W43: =VLOOKUP($L43,[summary.xls]MASTER!$F$8:$BF$88,48,TRUE) ->  | X43: =VLOOKUP($L43,[summary.xls]MASTER!$F$8:$BF$88,49,TRUE) ->  | Z43: =VLOOKUP($L43,[summary.xls]MASTER!$F$8:$BF$88,50,TRUE) ->  | AA43: =VLOOKUP($L43,[summary.xls]MASTER!$F$8:$BF$88,51,TRUE) ->  | AC43: =VLOOKUP($L43,[summary.xls]MASTER!$F$8:$BF$88,52,TRUE) ->  | AD43: =VLOOKUP($L43,[summary.xls]MASTER!$F$8:$BF$88,53,TRUE) -> 
K44: =RANK(N44,$N$18:$N$98,0) -> 27 | L44: Trevor | N44: =[summary.xls]Trevor!$E$173 -> 79 | O44: =[summary.xls]Trevor!$F$69 -> 47 | P44: =[summary.xls]Trevor!$F$148 -> 27 | Q44: =[summary.xls]Trevor!$F$168 -> 5 | R44: 0 | T44: =VLOOKUP($L44,[summary.xls]MASTER!$F$8:$BF$88,46,TRUE) ->  | U44: =VLOOKUP($L44,[summary.xls]MASTER!$F$8:$BF$88,47,TRUE) ->  | W44: =VLOOKUP($L44,[summary.xls]MASTER!$F$8:$BF$88,48,TRUE) ->  | X44: =VLOOKUP($L44,[summary.xls]MASTER!$F$8:$BF$88,49,TRUE) ->  | Z44: =VLOOKUP($L44,[summary.xls]MASTER!$F$8:$BF$88,50,TRUE) ->  | AA44: =VLOOKUP($L44,[summary.xls]MASTER!$F$8:$BF$88,51,TRUE) ->  | AC44: =VLOOKUP($L44,[summary.xls]MASTER!$F$8:$BF$88,52,TRUE) ->  | AD44: =VLOOKUP($L44,[summary.xls]MASTER!$F$8:$BF$88,53,TRUE) -> 
K45: =RANK(N45,$N$18:$N$98,0) -> 27 | L45: Derek | N45: =[summary.xls]Derek!$E$173 -> 79 | O45: =[summary.xls]Derek!$F$69 -> 44 | P45: =[summary.xls]Derek!$F$148 -> 30 | Q45: =[summary.xls]Derek!$F$168 -> 5 | R45: 0 | T45: =VLOOKUP($L45,[summary.xls]MASTER!$F$8:$BF$88,46,TRUE) ->  | U45: =VLOOKUP($L45,[summary.xls]MASTER!$F$8:$BF$88,47,TRUE) ->  | W45: =VLOOKUP($L45,[summary.xls]MASTER!$F$8:$BF$88,48,TRUE) ->  | X45: =VLOOKUP($L45,[summary.xls]MASTER!$F$8:$BF$88,49,TRUE) ->  | Z45: =VLOOKUP($L45,[summary.xls]MASTER!$F$8:$BF$88,50,TRUE) ->  | AA45: =VLOOKUP($L45,[summary.xls]MASTER!$F$8:$BF$88,51,TRUE) ->  | AC45: =VLOOKUP($L45,[summary.xls]MASTER!$F$8:$BF$88,52,TRUE) ->  | AD45: =VLOOKUP($L45,[summary.xls]MASTER!$F$8:$BF$88,53,TRUE) -> 
K46: =RANK(N46,$N$18:$N$98,0) -> 27 | L46: Rita | N46: =[summary.xls]Rita!$E$173 -> 79 | O46: =[summary.xls]Rita!$F$69 -> 36 | P46: =[summary.xls]Rita!$F$148 -> 38 | Q46: =[summary.xls]Rita!$F$168 -> 5 | R46: 0 | T46: =VLOOKUP($L46,[summary.xls]MASTER!$F$8:$BF$88,46,TRUE) ->  | U46: =VLOOKUP($L46,[summary.xls]MASTER!$F$8:$BF$88,47,TRUE) ->  | W46: =VLOOKUP($L46,[summary.xls]MASTER!$F$8:$BF$88,48,TRUE) ->  | X46: =VLOOKUP($L46,[summary.xls]MASTER!$F$8:$BF$88,49,TRUE) ->  | Z46: =VLOOKUP($L46,[summary.xls]MASTER!$F$8:$BF$88,50,TRUE) ->  | AA46: =VLOOKUP($L46,[summary.xls]MASTER!$F$8:$BF$88,51,TRUE) ->  | AC46: =VLOOKUP($L46,[summary.xls]MASTER!$F$8:$BF$88,52,TRUE) ->  | AD46: =VLOOKUP($L46,[summary.xls]MASTER!$F$8:$BF$88,53,TRUE) -> 
K47: =RANK(N47,$N$18:$N$98,0) -> 30 | L47: CharlesLal | N47: =[summary.xls]CharlesLal!$E$173 -> 78 | O47: =[summary.xls]CharlesLal!$F$69 -> 43 | P47: =[summary.xls]CharlesLal!$F$148 -> 30 | Q47: =[summary.xls]CharlesLal!$F$168 -> 5 | R47: 0 | T47: =VLOOKUP($L47,[summary.xls]MASTER!$F$8:$BF$88,46,TRUE) ->  | U47: =VLOOKUP($L47,[summary.xls]MASTER!$F$8:$BF$88,47,TRUE) ->  | W47: =VLOOKUP($L47,[summary.xls]MASTER!$F$8:$BF$88,48,TRUE) ->  | X47: =VLOOKUP($L47,[summary.xls]MASTER!$F$8:$BF$88,49,TRUE) ->  | Z47: =VLOOKUP($L47,[summary.xls]MASTER!$F$8:$BF$88,50,TRUE) ->  | AA47: =VLOOKUP($L47,[summary.xls]MASTER!$F$8:$BF$88,51,TRUE) ->  | AC47: =VLOOKUP($L47,[summary.xls]MASTER!$F$8:$BF$88,52,TRUE) ->  | AD47: =VLOOKUP($L47,[summary.xls]MASTER!$F$8:$BF$88,53,TRUE) -> 
K48: =RANK(N48,$N$18:$N$98,0) -> 30 | L48: Tenzin | N48: =[summary.xls]Tenzin!$E$173 -> 78 | O48: =[summary.xls]Tenzin!$F$69 -> 40 | P48: =[summary.xls]Tenzin!$F$148 -> 33 | Q48: =[summary.xls]Tenzin!$F$168 -> 5 | R48: 0 | T48: =VLOOKUP($L48,[summary.xls]MASTER!$F$8:$BF$88,46,TRUE) ->  | U48: =VLOOKUP($L48,[summary.xls]MASTER!$F$8:$BF$88,47,TRUE) ->  | W48: =VLOOKUP($L48,[summary.xls]MASTER!$F$8:$BF$88,48,TRUE) ->  | X48: =VLOOKUP($L48,[summary.xls]MASTER!$F$8:$BF$88,49,TRUE) ->  | Z48: =VLOOKUP($L48,[summary.xls]MASTER!$F$8:$BF$88,50,TRUE) ->  | AA48: =VLOOKUP($L48,[summary.xls]MASTER!$F$8:$BF$88,51,TRUE) ->  | AC48: =VLOOKUP($L48,[summary.xls]MASTER!$F$8:$BF$88,52,TRUE) ->  | AD48: =VLOOKUP($L48,[summary.xls]MASTER!$F$8:$BF$88,53,TRUE) -> 
K49: =RANK(N49,$N$18:$N$98,0) -> 30 | L49: Jenny | N49: =[summary.xls]Jenny!$E$173 -> 78 | O49: =[summary.xls]Jenny!$F$69 -> 39 | P49: =[summary.xls]Jenny!$F$148 -> 34 | Q49: =[summary.xls]Jenny!$F$168 -> 5 | R49: 0 | T49: =VLOOKUP($L49,[summary.xls]MASTER!$F$8:$BF$88,46,TRUE) ->  | U49: =VLOOKUP($L49,[summary.xls]MASTER!$F$8:$BF$88,47,TRUE) ->  | Z49: =VLOOKUP($L49,[summary.xls]MASTER!$F$8:$BF$88,50,TRUE) ->  | AA49: =VLOOKUP($L49,[summary.xls]MASTER!$F$8:$BF$88,51,TRUE) ->  | AC49: =VLOOKUP($L49,[summary.xls]MASTER!$F$8:$BF$88,52,TRUE) ->  | AD49: =VLOOKUP($L49,[summary.xls]MASTER!$F$8:$BF$88,53,TRUE) -> 
K50: =RANK(N50,$N$18:$N$98,0) -> 30 | L50: Lorena | N50: =[summary.xls]Lorena!$E$173 -> 78 | O50: =[summary.xls]Lorena!$F$69 -> 34 | P50: =[summary.xls]Lorena!$F$148 -> 39 | Q50: =[summary.xls]Lorena!$F$168 -> 5 | R50: 0 | T50: =VLOOKUP($L50,[summary.xls]MASTER!$F$8:$BF$88,46,TRUE) ->  | U50: =VLOOKUP($L50,[summary.xls]MASTER!$F$8:$BF$88,47,TRUE) ->  | W50: =VLOOKUP($L50,[summary.xls]MASTER!$F$8:$BF$88,48,TRUE) ->  | X50: =VLOOKUP($L50,[summary.xls]MASTER!$F$8:$BF$88,49,TRUE) ->  | Z50: =VLOOKUP($L50,[summary.xls]MASTER!$F$8:$BF$88,50,TRUE) ->  | AA50: =VLOOKUP($L50,[summary.xls]MASTER!$F$8:$BF$88,51,TRUE) ->  | AC50: =VLOOKUP($L50,[summary.xls]MASTER!$F$8:$BF$88,52,TRUE) ->  | AD50: =VLOOKUP($L50,[summary.xls]MASTER!$F$8:$BF$88,53,TRUE) -> 
K51: =RANK(N51,$N$18:$N$98,0) -> 34 | L51: Helder | N51: =[summary.xls]Helder!$E$173 -> 77 | O51: =[summary.xls]Helder!$F$69 -> 43 | P51: =[summary.xls]Helder!$F$148 -> 29 | Q51: =[summary.xls]Helder!$F$168 -> 5 | R51: 0 | T51: =VLOOKUP($L51,[summary.xls]MASTER!$F$8:$BF$88,46,TRUE) ->  | U51: =VLOOKUP($L51,[summary.xls]MASTER!$F$8:$BF$88,47,TRUE) ->  | W51: =VLOOKUP($L51,[summary.xls]MASTER!$F$8:$BF$88,48,TRUE) ->  | X51: =VLOOKUP($L51,[summary.xls]MASTER!$F$8:$BF$88,49,TRUE) ->  | Z51: =VLOOKUP($L51,[summary.xls]MASTER!$F$8:$BF$88,50,TRUE) ->  | AA51: =VLOOKUP($L51,[summary.xls]MASTER!$F$8:$BF$88,51,TRUE) ->  | AC51: =VLOOKUP($L51,[summary.xls]MASTER!$F$8:$BF$88,52,TRUE) ->  | AD51: =VLOOKUP($L51,[summary.xls]MASTER!$F$8:$BF$88,53,TRUE) -> 
K52: =RANK(N52,$N$18:$N$98,0) -> 34 | L52: Mauro | N52: =[summary.xls]Mauro!$E$173 -> 77 | O52: =[summary.xls]Mauro!$F$69 -> 39 | P52: =[summary.xls]Mauro!$F$148 -> 23 | Q52: =[summary.xls]Mauro!$F$168 -> 15 | R52: 0 | T52: =VLOOKUP($L52,[summary.xls]MASTER!$F$8:$BF$88,46,TRUE) ->  | U52: =VLOOKUP($L52,[summary.xls]MASTER!$F$8:$BF$88,47,TRUE) ->  | W52: =VLOOKUP($L52,[summary.xls]MASTER!$F$8:$BF$88,48,TRUE) ->  | X52: =VLOOKUP($L52,[summary.xls]MASTER!$F$8:$BF$88,49,TRUE) ->  | Z52: =VLOOKUP($L52,[summary.xls]MASTER!$F$8:$BF$88,50,TRUE) ->  | AA52: =VLOOKUP($L52,[summary.xls]MASTER!$F$8:$BF$88,51,TRUE) ->  | AC52: =VLOOKUP($L52,[summary.xls]MASTER!$F$8:$BF$88,52,TRUE) ->  | AD52: =VLOOKUP($L52,[summary.xls]MASTER!$F$8:$BF$88,53,TRUE) -> 
K53: =RANK(N53,$N$18:$N$98,0) -> 34 | L53: AshC | N53: =[summary.xls]AshC!$E$173 -> 77 | O53: =[summary.xls]AshC!$F$69 -> 35 | P53: =[summary.xls]AshC!$F$148 -> 37 | Q53: =[summary.xls]AshC!$F$168 -> 5 | R53: 0 | T53: =VLOOKUP($L53,[summary.xls]MASTER!$F$8:$BF$88,46,TRUE) ->  | U53: =VLOOKUP($L53,[summary.xls]MASTER!$F$8:$BF$88,47,TRUE) ->  | W53: =VLOOKUP($L53,[summary.xls]MASTER!$F$8:$BF$88,48,TRUE) ->  | X53: =VLOOKUP($L53,[summary.xls]MASTER!$F$8:$BF$88,49,TRUE) ->  | Z53: =VLOOKUP($L53,[summary.xls]MASTER!$F$8:$BF$88,50,TRUE) ->  | AA53: =VLOOKUP($L53,[summary.xls]MASTER!$F$8:$BF$88,51,TRUE) ->  | AC53: =VLOOKUP($L53,[summary.xls]MASTER!$F$8:$BF$88,52,TRUE) ->  | AD53: =VLOOKUP($L53,[summary.xls]MASTER!$F$8:$BF$88,53,TRUE) -> 
K54: =RANK(N54,$N$18:$N$98,0) -> 34 | L54: FrancoM | N54: =[summary.xls]FrancoM!$E$173 -> 77 | O54: =[summary.xls]FrancoM!$F$69 -> 35 | P54: =[summary.xls]FrancoM!$F$148 -> 32 | Q54: =[summary.xls]FrancoM!$F$168 -> 10 | R54: 0 | T54: =VLOOKUP($L54,[summary.xls]MASTER!$F$8:$BF$88,46,TRUE) ->  | U54: =VLOOKUP($L54,[summary.xls]MASTER!$F$8:$BF$88,47,TRUE) ->  | W54: =VLOOKUP($L54,[summary.xls]MASTER!$F$8:$BF$88,48,TRUE) ->  | X54: =VLOOKUP($L54,[summary.xls]MASTER!$F$8:$BF$88,49,TRUE) ->  | Z54: =VLOOKUP($L54,[summary.xls]MASTER!$F$8:$BF$88,50,TRUE) ->  | AA54: =VLOOKUP($L54,[summary.xls]MASTER!$F$8:$BF$88,51,TRUE) ->  | AC54: =VLOOKUP($L54,[summary.xls]MASTER!$F$8:$BF$88,52,TRUE) ->  | AD54: =VLOOKUP($L54,[summary.xls]MASTER!$F$8:$BF$88,53,TRUE) -> 
K55: =RANK(N55,$N$18:$N$98,0) -> 34 | L55: Echeta | N55: =[summary.xls]Echeta!$E$173 -> 77 | O55: =[summary.xls]Echeta!$F$69 -> 31 | P55: =[summary.xls]Echeta!$F$148 -> 31 | Q55: =[summary.xls]Echeta!$F$168 -> 15 | R55: 0 | T55: =VLOOKUP($L55,[summary.xls]MASTER!$F$8:$BF$88,46,TRUE) ->  | U55: =VLOOKUP($L55,[summary.xls]MASTER!$F$8:$BF$88,47,TRUE) ->  | W55: =VLOOKUP($L55,[summary.xls]MASTER!$F$8:$BF$88,48,TRUE) ->  | X55: =VLOOKUP($L55,[summary.xls]MASTER!$F$8:$BF$88,49,TRUE) ->  | Z55: =VLOOKUP($L55,[summary.xls]MASTER!$F$8:$BF$88,50,TRUE) ->  | AA55: =VLOOKUP($L55,[summary.xls]MASTER!$F$8:$BF$88,51,TRUE) ->  | AC55: =VLOOKUP($L55,[summary.xls]MASTER!$F$8:$BF$88,52,TRUE) ->  | AD55: =VLOOKUP($L55,[summary.xls]MASTER!$F$8:$BF$88,53,TRUE) -> 
K56: =RANK(N56,$N$18:$N$98,0) -> 39 | L56: DarryllS | N56: =[summary.xls]DarryllS!$E$173 -> 76 | O56: =[summary.xls]DarryllS!$F$69 -> 43 | P56: =[summary.xls]DarryllS!$F$148 -> 28 | Q56: =[summary.xls]DarryllS!$F$168 -> 5 | R56: 0 | T56: =VLOOKUP($L56,[summary.xls]MASTER!$F$8:$BF$88,46,TRUE) ->  | U56: =VLOOKUP($L56,[summary.xls]MASTER!$F$8:$BF$88,47,TRUE) ->  | Z56: =VLOOKUP($L56,[summary.xls]MASTER!$F$8:$BF$88,50,TRUE) ->  | AA56: =VLOOKUP($L56,[summary.xls]MASTER!$F$8:$BF$88,51,TRUE) ->  | AC56: =VLOOKUP($L56,[summary.xls]MASTER!$F$8:$BF$88,52,TRUE) ->  | AD56: =VLOOKUP($L56,[summary.xls]MASTER!$F$8:$BF$88,53,TRUE) -> 
K57: =RANK(N57,$N$18:$N$98,0) -> 39 | L57: GeorgeP | N57: =[summary.xls]GeorgeP!$E$173 -> 76 | O57: =[summary.xls]GeorgeP!$F$69 -> 37 | P57: =[summary.xls]GeorgeP!$F$148 -> 29 | Q57: =[summary.xls]GeorgeP!$F$168 -> 10 | R57: 0 | T57: =VLOOKUP($L57,[summary.xls]MASTER!$F$8:$BF$88,46,TRUE) ->  | U57: =VLOOKUP($L57,[summary.xls]MASTER!$F$8:$BF$88,47,TRUE) ->  | W57: =VLOOKUP($L57,[summary.xls]MASTER!$F$8:$BF$88,48,TRUE) ->  | X57: =VLOOKUP($L57,[summary.xls]MASTER!$F$8:$BF$88,49,TRUE) ->  | Z57: =VLOOKUP($L57,[summary.xls]MASTER!$F$8:$BF$88,50,TRUE) ->  | AA57: =VLOOKUP($L57,[summary.xls]MASTER!$F$8:$BF$88,51,TRUE) ->  | AC57: =VLOOKUP($L57,[summary.xls]MASTER!$F$8:$BF$88,52,TRUE) ->  | AD57: =VLOOKUP($L57,[summary.xls]MASTER!$F$8:$BF$88,53,TRUE) -> 
K58: =RANK(N58,$N$18:$N$98,0) -> 39 | L58: Helio | N58: =[summary.xls]Helio!$E$173 -> 76 | O58: =[summary.xls]Helio!$F$69 -> 36 | P58: =[summary.xls]Helio!$F$148 -> 30 | Q58: =[summary.xls]Helio!$F$168 -> 10 | R58: 0 | T58: =VLOOKUP($L58,[summary.xls]MASTER!$F$8:$BF$88,46,TRUE) ->  | U58: =VLOOKUP($L58,[summary.xls]MASTER!$F$8:$BF$88,47,TRUE) ->  | W58: =VLOOKUP($L58,[summary.xls]MASTER!$F$8:$BF$88,48,TRUE) ->  | X58: =VLOOKUP($L58,[summary.xls]MASTER!$F$8:$BF$88,49,TRUE) ->  | Z58: =VLOOKUP($L58,[summary.xls]MASTER!$F$8:$BF$88,50,TRUE) ->  | AA58: =VLOOKUP($L58,[summary.xls]MASTER!$F$8:$BF$88,51,TRUE) ->  | AC58: =VLOOKUP($L58,[summary.xls]MASTER!$F$8:$BF$88,52,TRUE) ->  | AD58: =VLOOKUP($L58,[summary.xls]MASTER!$F$8:$BF$88,53,TRUE) -> 
K59: =RANK(N59,$N$18:$N$98,0) -> 42 | L59: Marcelo | N59: =[summary.xls]Marcelo!$E$173 -> 75 | O59: =[summary.xls]Marcelo!$F$69 -> 42 | P59: =[summary.xls]Marcelo!$F$148 -> 28 | Q59: =[summary.xls]Marcelo!$F$168 -> 5 | R59: 0 | T59: =VLOOKUP($L59,[summary.xls]MASTER!$F$8:$BF$88,46,TRUE) ->  | U59: =VLOOKUP($L59,[summary.xls]MASTER!$F$8:$BF$88,47,TRUE) ->  | W59: =VLOOKUP($L59,[summary.xls]MASTER!$F$8:$BF$88,48,TRUE) ->  | X59: =VLOOKUP($L59,[summary.xls]MASTER!$F$8:$BF$88,49,TRUE) ->  | Z59: =VLOOKUP($L59,[summary.xls]MASTER!$F$8:$BF$88,50,TRUE) ->  | AA59: =VLOOKUP($L59,[summary.xls]MASTER!$F$8:$BF$88,51,TRUE) ->  | AC59: =VLOOKUP($L59,[summary.xls]MASTER!$F$8:$BF$88,52,TRUE) ->  | AD59: =VLOOKUP($L59,[summary.xls]MASTER!$F$8:$BF$88,53,TRUE) -> 
K60: =RANK(N60,$N$18:$N$98,0) -> 42 | L60: FrancoP | N60: =[summary.xls]FrancoP!$E$173 -> 75 | O60: =[summary.xls]FrancoP!$F$69 -> 37 | P60: =[summary.xls]FrancoP!$F$148 -> 33 | Q60: =[summary.xls]FrancoP!$F$168 -> 5 | R60: 0 | T60: =VLOOKUP($L60,[summary.xls]MASTER!$F$8:$BF$88,46,TRUE) ->  | U60: =VLOOKUP($L60,[summary.xls]MASTER!$F$8:$BF$88,47,TRUE) ->  | W60: =VLOOKUP($L60,[summary.xls]MASTER!$F$8:$BF$88,48,TRUE) ->  | X60: =VLOOKUP($L60,[summary.xls]MASTER!$F$8:$BF$88,49,TRUE) ->  | Z60: =VLOOKUP($L60,[summary.xls]MASTER!$F$8:$BF$88,50,TRUE) ->  | AA60: =VLOOKUP($L60,[summary.xls]MASTER!$F$8:$BF$88,51,TRUE) ->  | AC60: =VLOOKUP($L60,[summary.xls]MASTER!$F$8:$BF$88,52,TRUE) ->  | AD60: =VLOOKUP($L60,[summary.xls]MASTER!$F$8:$BF$88,53,TRUE) -> 
K61: =RANK(N61,$N$18:$N$98,0) -> 42 | L61: Jeff | N61: =[summary.xls]Jeff!$E$173 -> 75 | O61: =[summary.xls]Jeff!$F$69 -> 32 | P61: =[summary.xls]Jeff!$F$148 -> 28 | Q61: =[summary.xls]Jeff!$F$168 -> 15 | R61: 0 | T61: =VLOOKUP($L61,[summary.xls]MASTER!$F$8:$BF$88,46,TRUE) ->  | U61: =VLOOKUP($L61,[summary.xls]MASTER!$F$8:$BF$88,47,TRUE) ->  | W61: =VLOOKUP($L61,[summary.xls]MASTER!$F$8:$BF$88,48,TRUE) ->  | X61: =VLOOKUP($L61,[summary.xls]MASTER!$F$8:$BF$88,49,TRUE) ->  | Z61: =VLOOKUP($L61,[summary.xls]MASTER!$F$8:$BF$88,50,TRUE) ->  | AA61: =VLOOKUP($L61,[summary.xls]MASTER!$F$8:$BF$88,51,TRUE) ->  | AC61: =VLOOKUP($L61,[summary.xls]MASTER!$F$8:$BF$88,52,TRUE) ->  | AD61: =VLOOKUP($L61,[summary.xls]MASTER!$F$8:$BF$88,53,TRUE) -> 
K62: =RANK(N62,$N$18:$N$98,0) -> 45 | L62: Fernando | N62: =[summary.xls]Fernando!$E$173 -> 74 | O62: =[summary.xls]Fernando!$F$69 -> 35 | P62: =[summary.xls]Fernando!$F$148 -> 29 | Q62: =[summary.xls]Fernando!$F$168 -> 10 | R62: 0 | T62: =VLOOKUP($L62,[summary.xls]MASTER!$F$8:$BF$88,46,TRUE) ->  | U62: =VLOOKUP($L62,[summary.xls]MASTER!$F$8:$BF$88,47,TRUE) ->  | W62: =VLOOKUP($L62,[summary.xls]MASTER!$F$8:$BF$88,48,TRUE) ->  | X62: =VLOOKUP($L62,[summary.xls]MASTER!$F$8:$BF$88,49,TRUE) ->  | Z62: =VLOOKUP($L62,[summary.xls]MASTER!$F$8:$BF$88,50,TRUE) ->  | AA62: =VLOOKUP($L62,[summary.xls]MASTER!$F$8:$BF$88,51,TRUE) ->  | AC62: =VLOOKUP($L62,[summary.xls]MASTER!$F$8:$BF$88,52,TRUE) ->  | AD62: =VLOOKUP($L62,[summary.xls]MASTER!$F$8:$BF$88,53,TRUE) -> 
K63: =RANK(N63,$N$18:$N$98,0) -> 45 | L63: Grace | N63: =[summary.xls]Grace!$E$173 -> 74 | O63: =[summary.xls]Grace!$F$69 -> 32 | P63: =[summary.xls]Grace!$F$148 -> 37 | Q63: =[summary.xls]Grace!$F$168 -> 5 | R63: 0 | T63: =VLOOKUP($L63,[summary.xls]MASTER!$F$8:$BF$88,46,TRUE) ->  | U63: =VLOOKUP($L63,[summary.xls]MASTER!$F$8:$BF$88,47,TRUE) ->  | W63: =VLOOKUP($L63,[summary.xls]MASTER!$F$8:$BF$88,48,TRUE) ->  | X63: =VLOOKUP($L63,[summary.xls]MASTER!$F$8:$BF$88,49,TRUE) ->  | Z63: =VLOOKUP($L63,[summary.xls]MASTER!$F$8:$BF$88,50,TRUE) ->  | AA63: =VLOOKUP($L63,[summary.xls]MASTER!$F$8:$BF$88,51,TRUE) ->  | AC63: =VLOOKUP($L63,[summary.xls]MASTER!$F$8:$BF$88,52,TRUE) ->  | AD63: =VLOOKUP($L63,[summary.xls]MASTER!$F$8:$BF$88,53,TRUE) -> 
K64: =RANK(N64,$N$18:$N$98,0) -> 45 | L64: BrianD | N64: =[summary.xls]BrianD!$E$173 -> 74 | O64: =[summary.xls]BrianD!$F$69 -> 31 | P64: =[summary.xls]BrianD!$F$148 -> 33 | Q64: =[summary.xls]BrianD!$F$168 -> 10 | R64: 0 | T64: =VLOOKUP($L64,[summary.xls]MASTER!$F$8:$BF$88,46,TRUE) ->  | U64: =VLOOKUP($L64,[summary.xls]MASTER!$F$8:$BF$88,47,TRUE) ->  | W64: =VLOOKUP($L64,[summary.xls]MASTER!$F$8:$BF$88,48,TRUE) ->  | X64: =VLOOKUP($L64,[summary.xls]MASTER!$F$8:$BF$88,49,TRUE) ->  | Z64: =VLOOKUP($L64,[summary.xls]MASTER!$F$8:$BF$88,50,TRUE) ->  | AA64: =VLOOKUP($L64,[summary.xls]MASTER!$F$8:$BF$88,51,TRUE) ->  | AC64: =VLOOKUP($L64,[summary.xls]MASTER!$F$8:$BF$88,52,TRUE) ->  | AD64: =VLOOKUP($L64,[summary.xls]MASTER!$F$8:$BF$88,53,TRUE) -> 
K65: =RANK(N65,$N$18:$N$98,0) -> 45 | L65: Matt | N65: =[summary.xls]Matt!$E$173 -> 74 | O65: =[summary.xls]Matt!$F$69 -> 29 | P65: =[summary.xls]Matt!$F$148 -> 20 | Q65: =[summary.xls]Matt!$F$168 -> 25 | R65: 0 | T65: =VLOOKUP($L65,[summary.xls]MASTER!$F$8:$BF$88,46,TRUE) ->  | U65: =VLOOKUP($L65,[summary.xls]MASTER!$F$8:$BF$88,47,TRUE) ->  | W65: =VLOOKUP($L65,[summary.xls]MASTER!$F$8:$BF$88,48,TRUE) ->  | X65: =VLOOKUP($L65,[summary.xls]MASTER!$F$8:$BF$88,49,TRUE) ->  | Z65: =VLOOKUP($L65,[summary.xls]MASTER!$F$8:$BF$88,50,TRUE) ->  | AA65: =VLOOKUP($L65,[summary.xls]MASTER!$F$8:$BF$88,51,TRUE) ->  | AC65: =VLOOKUP($L65,[summary.xls]MASTER!$F$8:$BF$88,52,TRUE) ->  | AD65: =VLOOKUP($L65,[summary.xls]MASTER!$F$8:$BF$88,53,TRUE) -> 
K66: =RANK(N66,$N$18:$N$98,0) -> 49 | L66: Tiago | N66: =[summary.xls]Tiago!$E$173 -> 73 | O66: =[summary.xls]Tiago!$F$69 -> 38 | P66: =[summary.xls]Tiago!$F$148 -> 25 | Q66: =[summary.xls]Tiago!$F$168 -> 10 | R66: 0 | T66: =VLOOKUP($L66,[summary.xls]MASTER!$F$8:$BF$88,46,TRUE) ->  | U66: =VLOOKUP($L66,[summary.xls]MASTER!$F$8:$BF$88,47,TRUE) ->  | W66: =VLOOKUP($L66,[summary.xls]MASTER!$F$8:$BF$88,48,TRUE) ->  | X66: =VLOOKUP($L66,[summary.xls]MASTER!$F$8:$BF$88,49,TRUE) ->  | Z66: =VLOOKUP($L66,[summary.xls]MASTER!$F$8:$BF$88,50,TRUE) ->  | AA66: =VLOOKUP($L66,[summary.xls]MASTER!$F$8:$BF$88,51,TRUE) ->  | AC66: =VLOOKUP($L66,[summary.xls]MASTER!$F$8:$BF$88,52,TRUE) ->  | AD66: =VLOOKUP($L66,[summary.xls]MASTER!$F$8:$BF$88,53,TRUE) -> 
K67: =RANK(N67,$N$18:$N$98,0) -> 49 | L67: Mohammed | N67: =[summary.xls]Mohammed!$E$173 -> 73 | O67: =[summary.xls]Mohammed!$F$69 -> 34 | P67: =[summary.xls]Mohammed!$F$148 -> 24 | Q67: =[summary.xls]Mohammed!$F$168 -> 15 | R67: 0 | T67: =VLOOKUP($L67,[summary.xls]MASTER!$F$8:$BF$88,46,TRUE) ->  | U67: =VLOOKUP($L67,[summary.xls]MASTER!$F$8:$BF$88,47,TRUE) ->  | W67: =VLOOKUP($L67,[summary.xls]MASTER!$F$8:$BF$88,48,TRUE) ->  | X67: =VLOOKUP($L67,[summary.xls]MASTER!$F$8:$BF$88,49,TRUE) ->  | Z67: =VLOOKUP($L67,[summary.xls]MASTER!$F$8:$BF$88,50,TRUE) ->  | AA67: =VLOOKUP($L67,[summary.xls]MASTER!$F$8:$BF$88,51,TRUE) ->  | AC67: =VLOOKUP($L67,[summary.xls]MASTER!$F$8:$BF$88,52,TRUE) ->  | AD67: =VLOOKUP($L67,[summary.xls]MASTER!$F$8:$BF$88,53,TRUE) -> 
K68: =RANK(N68,$N$18:$N$98,0) -> 49 | L68: Helmar | N68: =[summary.xls]Helmar!$E$173 -> 73 | O68: =[summary.xls]Helmar!$F$69 -> 33 | P68: =[summary.xls]Helmar!$F$148 -> 35 | Q68: =[summary.xls]Helmar!$F$168 -> 5 | R68: 0 | T68: =VLOOKUP($L68,[summary.xls]MASTER!$F$8:$BF$88,46,TRUE) ->  | U68: =VLOOKUP($L68,[summary.xls]MASTER!$F$8:$BF$88,47,TRUE) ->  | W68: =VLOOKUP($L68,[summary.xls]MASTER!$F$8:$BF$88,48,TRUE) ->  | X68: =VLOOKUP($L68,[summary.xls]MASTER!$F$8:$BF$88,49,TRUE) ->  | Z68: =VLOOKUP($L68,[summary.xls]MASTER!$F$8:$BF$88,50,TRUE) ->  | AA68: =VLOOKUP($L68,[summary.xls]MASTER!$F$8:$BF$88,51,TRUE) -> 
K69: =RANK(N69,$N$18:$N$98,0) -> 49 | L69: Marta | N69: =[summary.xls]Marta!$E$173 -> 73 | O69: =[summary.xls]Marta!$F$69 -> 33 | P69: =[summary.xls]Marta!$F$148 -> 35 | Q69: =[summary.xls]Marta!$F$168 -> 5 | R69: 0 | T69: =VLOOKUP($L69,[summary.xls]MASTER!$F$8:$BF$88,46,TRUE) ->  | U69: =VLOOKUP($L69,[summary.xls]MASTER!$F$8:$BF$88,47,TRUE) ->  | W69: =VLOOKUP($L69,[summary.xls]MASTER!$F$8:$BF$88,48,TRUE) ->  | X69: =VLOOKUP($L69,[summary.xls]MASTER!$F$8:$BF$88,49,TRUE) ->  | Z69: =VLOOKUP($L69,[summary.xls]MASTER!$F$8:$BF$88,50,TRUE) ->  | AA69: =VLOOKUP($L69,[summary.xls]MASTER!$F$8:$BF$88,51,TRUE) ->  | AC69: =VLOOKUP($L69,[summary.xls]MASTER!$F$8:$BF$88,52,TRUE) ->  | AD69: =VLOOKUP($L69,[summary.xls]MASTER!$F$8:$BF$88,53,TRUE) -> 
K70: =RANK(N70,$N$18:$N$98,0) -> 49 | L70: Kevin | N70: =[summary.xls]Kevin!$E$173 -> 73 | O70: =[summary.xls]Kevin!$F$69 -> 32 | P70: =[summary.xls]Kevin!$F$148 -> 36 | Q70: =[summary.xls]Kevin!$F$168 -> 5 | R70: 0 | T70: =VLOOKUP($L70,[summary.xls]MASTER!$F$8:$BF$88,46,TRUE) ->  | U70: =VLOOKUP($L70,[summary.xls]MASTER!$F$8:$BF$88,47,TRUE) ->  | W70: =VLOOKUP($L70,[summary.xls]MASTER!$F$8:$BF$88,48,TRUE) ->  | X70: =VLOOKUP($L70,[summary.xls]MASTER!$F$8:$BF$88,49,TRUE) ->  | Z70: =VLOOKUP($L70,[summary.xls]MASTER!$F$8:$BF$88,50,TRUE) ->  | AA70: =VLOOKUP($L70,[summary.xls]MASTER!$F$8:$BF$88,51,TRUE) ->  | AC70: =VLOOKUP($L70,[summary.xls]MASTER!$F$8:$BF$88,52,TRUE) ->  | AD70: =VLOOKUP($L70,[summary.xls]MASTER!$F$8:$BF$88,53,TRUE) -> 
K71: =RANK(N71,$N$18:$N$98,0) -> 54 | L71: Marcio | N71: =[summary.xls]Marcio!$E$173 -> 71 | O71: =[summary.xls]Marcio!$F$69 -> 37 | P71: =[summary.xls]Marcio!$F$148 -> 24 | Q71: =[summary.xls]Marcio!$F$168 -> 10 | R71: 0 | T71: =VLOOKUP($L71,[summary.xls]MASTER!$F$8:$BF$88,46,TRUE) ->  | U71: =VLOOKUP($L71,[summary.xls]MASTER!$F$8:$BF$88,47,TRUE) ->  | W71: =VLOOKUP($L71,[summary.xls]MASTER!$F$8:$BF$88,48,TRUE) ->  | X71: =VLOOKUP($L71,[summary.xls]MASTER!$F$8:$BF$88,49,TRUE) ->  | Z71: =VLOOKUP($L71,[summary.xls]MASTER!$F$8:$BF$88,50,TRUE) ->  | AA71: =VLOOKUP($L71,[summary.xls]MASTER!$F$8:$BF$88,51,TRUE) ->  | AC71: =VLOOKUP($L71,[summary.xls]MASTER!$F$8:$BF$88,52,TRUE) ->  | AD71: =VLOOKUP($L71,[summary.xls]MASTER!$F$8:$BF$88,53,TRUE) -> 
K72: =RANK(N72,$N$18:$N$98,0) -> 54 | L72: Alex1 | N72: =[summary.xls]Alex1!$E$173 -> 71 | O72: =[summary.xls]Alex1!$F$69 -> 32 | P72: =[summary.xls]Alex1!$F$148 -> 19 | Q72: =[summary.xls]Alex1!$F$168 -> 20 | R72: 0 | T72: =VLOOKUP($L72,[summary.xls]MASTER!$F$8:$BF$88,46,TRUE) ->  | U72: =VLOOKUP($L72,[summary.xls]MASTER!$F$8:$BF$88,47,TRUE) ->  | W72: =VLOOKUP($L72,[summary.xls]MASTER!$F$8:$BF$88,48,TRUE) ->  | X72: =VLOOKUP($L72,[summary.xls]MASTER!$F$8:$BF$88,49,TRUE) ->  | Z72: =VLOOKUP($L72,[summary.xls]MASTER!$F$8:$BF$88,50,TRUE) ->  | AA72: =VLOOKUP($L72,[summary.xls]MASTER!$F$8:$BF$88,51,TRUE) ->  | AC72: =VLOOKUP($L72,[summary.xls]MASTER!$F$8:$BF$88,52,TRUE) ->  | AD72: =VLOOKUP($L72,[summary.xls]MASTER!$F$8:$BF$88,53,TRUE) -> 
K73: =RANK(N73,$N$18:$N$98,0) -> 56 | L73: Ian | N73: =[summary.xls]Ian!$E$173 -> 70 | O73: =[summary.xls]Ian!$F$69 -> 36 | P73: =[summary.xls]Ian!$F$148 -> 29 | Q73: =[summary.xls]Ian!$F$168 -> 5 | R73: 0 | T73: =VLOOKUP($L73,[summary.xls]MASTER!$F$8:$BF$88,46,TRUE) ->  | U73: =VLOOKUP($L73,[summary.xls]MASTER!$F$8:$BF$88,47,TRUE) ->  | W73: =VLOOKUP($L73,[summary.xls]MASTER!$F$8:$BF$88,48,TRUE) ->  | X73: =VLOOKUP($L73,[summary.xls]MASTER!$F$8:$BF$88,49,TRUE) ->  | Z73: =VLOOKUP($L73,[summary.xls]MASTER!$F$8:$BF$88,50,TRUE) ->  | AA73: =VLOOKUP($L73,[summary.xls]MASTER!$F$8:$BF$88,51,TRUE) ->  | AC73: =VLOOKUP($L73,[summary.xls]MASTER!$F$8:$BF$88,52,TRUE) ->  | AD73: =VLOOKUP($L73,[summary.xls]MASTER!$F$8:$BF$88,53,TRUE) -> 
K74: =RANK(N74,$N$18:$N$98,0) -> 57 | L74: Brian1 | N74: =[summary.xls]Brian1!$E$173 -> 69 | O74: =[summary.xls]Brian1!$F$69 -> 33 | P74: =[summary.xls]Brian1!$F$148 -> 26 | Q74: =[summary.xls]Brian1!$F$168 -> 10 | R74: 0 | T74: =VLOOKUP($L74,[summary.xls]MASTER!$F$8:$BF$88,46,TRUE) ->  | U74: =VLOOKUP($L74,[summary.xls]MASTER!$F$8:$BF$88,47,TRUE) ->  | W74: =VLOOKUP($L74,[summary.xls]MASTER!$F$8:$BF$88,48,TRUE) ->  | X74: =VLOOKUP($L74,[summary.xls]MASTER!$F$8:$BF$88,49,TRUE) ->  | Z74: =VLOOKUP($L74,[summary.xls]MASTER!$F$8:$BF$88,50,TRUE) ->  | AA74: =VLOOKUP($L74,[summary.xls]MASTER!$F$8:$BF$88,51,TRUE) ->  | AC74: =VLOOKUP($L74,[summary.xls]MASTER!$F$8:$BF$88,52,TRUE) ->  | AD74: =VLOOKUP($L74,[summary.xls]MASTER!$F$8:$BF$88,53,TRUE) -> 
K75: =RANK(N75,$N$18:$N$98,0) -> 57 | L75: Denzil | N75: =[summary.xls]Denzil!$E$173 -> 69 | O75: =[summary.xls]Denzil!$F$69 -> 33 | P75: =[summary.xls]Denzil!$F$148 -> 31 | Q75: =[summary.xls]Denzil!$F$168 -> 5 | R75: 0 | T75: =VLOOKUP($L75,[summary.xls]MASTER!$F$8:$BF$88,46,TRUE) ->  | U75: =VLOOKUP($L75,[summary.xls]MASTER!$F$8:$BF$88,47,TRUE) ->  | W75: =VLOOKUP($L75,[summary.xls]MASTER!$F$8:$BF$88,48,TRUE) ->  | X75: =VLOOKUP($L75,[summary.xls]MASTER!$F$8:$BF$88,49,TRUE) ->  | Z75: =VLOOKUP($L75,[summary.xls]MASTER!$F$8:$BF$88,50,TRUE) ->  | AA75: =VLOOKUP($L75,[summary.xls]MASTER!$F$8:$BF$88,51,TRUE) ->  | AC75: =VLOOKUP($L75,[summary.xls]MASTER!$F$8:$BF$88,52,TRUE) ->  | AD75: =VLOOKUP($L75,[summary.xls]MASTER!$F$8:$BF$88,53,TRUE) -> 
K76: =RANK(N76,$N$18:$N$98,0) -> 59 | L76: Telmo | N76: =[summary.xls]Telmo!$E$173 -> 68 | O76: =[summary.xls]Telmo!$F$69 -> 36 | P76: =[summary.xls]Telmo!$F$148 -> 27 | Q76: =[summary.xls]Telmo!$F$168 -> 5 | R76: 0 | T76: =VLOOKUP($L76,[summary.xls]MASTER!$F$8:$BF$88,46,TRUE) ->  | U76: =VLOOKUP($L76,[summary.xls]MASTER!$F$8:$BF$88,47,TRUE) ->  | W76: =VLOOKUP($L76,[summary.xls]MASTER!$F$8:$BF$88,48,TRUE) ->  | X76: =VLOOKUP($L76,[summary.xls]MASTER!$F$8:$BF$88,49,TRUE) ->  | Z76: =VLOOKUP($L76,[summary.xls]MASTER!$F$8:$BF$88,50,TRUE) ->  | AA76: =VLOOKUP($L76,[summary.xls]MASTER!$F$8:$BF$88,51,TRUE) ->  | AC76: =VLOOKUP($L76,[summary.xls]MASTER!$F$8:$BF$88,52,TRUE) ->  | AD76: =VLOOKUP($L76,[summary.xls]MASTER!$F$8:$BF$88,53,TRUE) -> 
K77: =RANK(N77,$N$18:$N$98,0) -> 60 | L77: Corey | N77: =[summary.xls]Corey!$E$173 -> 67 | O77: =[summary.xls]Corey!$F$69 -> 33 | P77: =[summary.xls]Corey!$F$148 -> 34 | Q77: =[summary.xls]Corey!$F$168 -> 0 | R77: 0 | T77: =VLOOKUP($L77,[summary.xls]MASTER!$F$8:$BF$88,46,TRUE) ->  | U77: =VLOOKUP($L77,[summary.xls]MASTER!$F$8:$BF$88,47,TRUE) ->  | Z77: =VLOOKUP($L77,[summary.xls]MASTER!$F$8:$BF$88,50,TRUE) ->  | AA77: =VLOOKUP($L77,[summary.xls]MASTER!$F$8:$BF$88,51,TRUE) ->  | AC77: =VLOOKUP($L77,[summary.xls]MASTER!$F$8:$BF$88,52,TRUE) ->  | AD77: =VLOOKUP($L77,[summary.xls]MASTER!$F$8:$BF$88,53,TRUE) -> 
K78: =RANK(N78,$N$18:$N$98,0) -> 61 | L78: Nuno | N78: =[summary.xls]Nuno!$E$173 -> 66 | O78: =[summary.xls]Nuno!$F$69 -> 35 | P78: =[summary.xls]Nuno!$F$148 -> 31 | Q78: =[summary.xls]Nuno!$F$168 -> 0 | R78: 0 | T78: =VLOOKUP($L78,[summary.xls]MASTER!$F$8:$BF$88,46,TRUE) ->  | U78: =VLOOKUP($L78,[summary.xls]MASTER!$F$8:$BF$88,47,TRUE) ->  | W78: =VLOOKUP($L78,[summary.xls]MASTER!$F$8:$BF$88,48,TRUE) ->  | X78: =VLOOKUP($L78,[summary.xls]MASTER!$F$8:$BF$88,49,TRUE) ->  | Z78: =VLOOKUP($L78,[summary.xls]MASTER!$F$8:$BF$88,50,TRUE) ->  | AA78: =VLOOKUP($L78,[summary.xls]MASTER!$F$8:$BF$88,51,TRUE) ->  | AC78: =VLOOKUP($L78,[summary.xls]MASTER!$F$8:$BF$88,52,TRUE) ->  | AD78: =VLOOKUP($L78,[summary.xls]MASTER!$F$8:$BF$88,53,TRUE) -> 
K79: =RANK(N79,$N$18:$N$98,0) -> 61 | L79: David | N79: =[summary.xls]David!$E$173 -> 66 | O79: =[summary.xls]David!$F$69 -> 34 | P79: =[summary.xls]David!$F$148 -> 27 | Q79: =[summary.xls]David!$F$168 -> 5 | R79: 0 | T79: =VLOOKUP($L79,[summary.xls]MASTER!$F$8:$BF$88,46,TRUE) ->  | U79: =VLOOKUP($L79,[summary.xls]MASTER!$F$8:$BF$88,47,TRUE) ->  | W79: =VLOOKUP($L79,[summary.xls]MASTER!$F$8:$BF$88,48,TRUE) ->  | X79: =VLOOKUP($L79,[summary.xls]MASTER!$F$8:$BF$88,49,TRUE) ->  | Z79: =VLOOKUP($L79,[summary.xls]MASTER!$F$8:$BF$88,50,TRUE) ->  | AA79: =VLOOKUP($L79,[summary.xls]MASTER!$F$8:$BF$88,51,TRUE) ->  | AC79: =VLOOKUP($L79,[summary.xls]MASTER!$F$8:$BF$88,52,TRUE) ->  | AD79: =VLOOKUP($L79,[summary.xls]MASTER!$F$8:$BF$88,53,TRUE) -> 
K80: =RANK(N80,$N$18:$N$98,0) -> 61 | L80: Daisy | N80: =[summary.xls]Daisy!$E$173 -> 66 | O80: =[summary.xls]Daisy!$F$69 -> 33 | P80: =[summary.xls]Daisy!$F$148 -> 28 | Q80: =[summary.xls]Daisy!$F$168 -> 5 | R80: 0 | T80: =VLOOKUP($L80,[summary.xls]MASTER!$F$8:$BF$88,46,TRUE) ->  | U80: =VLOOKUP($L80,[summary.xls]MASTER!$F$8:$BF$88,47,TRUE) ->  | W80: =VLOOKUP($L80,[summary.xls]MASTER!$F$8:$BF$88,48,TRUE) ->  | X80: =VLOOKUP($L80,[summary.xls]MASTER!$F$8:$BF$88,49,TRUE) ->  | Z80: =VLOOKUP($L80,[summary.xls]MASTER!$F$8:$BF$88,50,TRUE) ->  | AA80: =VLOOKUP($L80,[summary.xls]MASTER!$F$8:$BF$88,51,TRUE) ->  | AC80: =VLOOKUP($L80,[summary.xls]MASTER!$F$8:$BF$88,52,TRUE) ->  | AD80: =VLOOKUP($L80,[summary.xls]MASTER!$F$8:$BF$88,53,TRUE) -> 
K81: =RANK(N81,$N$18:$N$98,0) -> 61 | L81: Hugo | N81: =[summary.xls]Hugo!$E$173 -> 66 | O81: =[summary.xls]Hugo!$F$69 -> 27 | P81: =[summary.xls]Hugo!$F$148 -> 24 | Q81: =[summary.xls]Hugo!$F$168 -> 15 | R81: 0 | T81: =VLOOKUP($L81,[summary.xls]MASTER!$F$8:$BF$88,46,TRUE) ->  | U81: =VLOOKUP($L81,[summary.xls]MASTER!$F$8:$BF$88,47,TRUE) ->  | W81: =VLOOKUP($L81,[summary.xls]MASTER!$F$8:$BF$88,48,TRUE) ->  | X81: =VLOOKUP($L81,[summary.xls]MASTER!$F$8:$BF$88,49,TRUE) ->  | Z81: =VLOOKUP($L81,[summary.xls]MASTER!$F$8:$BF$88,50,TRUE) ->  | AA81: =VLOOKUP($L81,[summary.xls]MASTER!$F$8:$BF$88,51,TRUE) ->  | AC81: =VLOOKUP($L81,[summary.xls]MASTER!$F$8:$BF$88,52,TRUE) ->  | AD81: =VLOOKUP($L81,[summary.xls]MASTER!$F$8:$BF$88,53,TRUE) -> 
K82: =RANK(N82,$N$18:$N$98,0) -> 65 | L82: Kristian | N82: =[summary.xls]Kristian!$E$173 -> 65 | O82: =[summary.xls]Kristian!$F$69 -> 37 | P82: =[summary.xls]Kristian!$F$148 -> 18 | Q82: =[summary.xls]Kristian!$F$168 -> 10 | R82: 0 | T82: =VLOOKUP($L82,[summary.xls]MASTER!$F$8:$BF$88,46,TRUE) ->  | U82: =VLOOKUP($L82,[summary.xls]MASTER!$F$8:$BF$88,47,TRUE) ->  | W82: =VLOOKUP($L82,[summary.xls]MASTER!$F$8:$BF$88,48,TRUE) ->  | X82: =VLOOKUP($L82,[summary.xls]MASTER!$F$8:$BF$88,49,TRUE) ->  | Z82: =VLOOKUP($L82,[summary.xls]MASTER!$F$8:$BF$88,50,TRUE) ->  | AA82: =VLOOKUP($L82,[summary.xls]MASTER!$F$8:$BF$88,51,TRUE) ->  | AC82: =VLOOKUP($L82,[summary.xls]MASTER!$F$8:$BF$88,52,TRUE) ->  | AD82: =VLOOKUP($L82,[summary.xls]MASTER!$F$8:$BF$88,53,TRUE) -> 
K83: =RANK(N83,$N$18:$N$98,0) -> 65 | L83: Alex2 | N83: =[summary.xls]Alex2!$E$173 -> 65 | O83: =[summary.xls]Alex2!$F$69 -> 35 | P83: =[summary.xls]Alex2!$F$148 -> 25 | Q83: =[summary.xls]Alex2!$F$168 -> 5 | R83: 0 | T83: =VLOOKUP($L83,[summary.xls]MASTER!$F$8:$BF$88,46,TRUE) ->  | U83: =VLOOKUP($L83,[summary.xls]MASTER!$F$8:$BF$88,47,TRUE) ->  | Z83: =VLOOKUP($L83,[summary.xls]MASTER!$F$8:$BF$88,50,TRUE) ->  | AA83: =VLOOKUP($L83,[summary.xls]MASTER!$F$8:$BF$88,51,TRUE) ->  | AC83: =VLOOKUP($L83,[summary.xls]MASTER!$F$8:$BF$88,52,TRUE) ->  | AD83: =VLOOKUP($L83,[summary.xls]MASTER!$F$8:$BF$88,53,TRUE) -> 
K84: =RANK(N84,$N$18:$N$98,0) -> 65 | L84: John | N84: =[summary.xls]John!$E$173 -> 65 | O84: =[summary.xls]John!$F$69 -> 33 | P84: =[summary.xls]John!$F$148 -> 27 | Q84: =[summary.xls]John!$F$168 -> 5 | R84: 0 | T84: =VLOOKUP($L84,[summary.xls]MASTER!$F$8:$BF$88,46,TRUE) ->  | U84: =VLOOKUP($L84,[summary.xls]MASTER!$F$8:$BF$88,47,TRUE) ->  | W84: =VLOOKUP($L84,[summary.xls]MASTER!$F$8:$BF$88,48,TRUE) ->  | X84: =VLOOKUP($L84,[summary.xls]MASTER!$F$8:$BF$88,49,TRUE) ->  | Z84: =VLOOKUP($L84,[summary.xls]MASTER!$F$8:$BF$88,50,TRUE) ->  | AA84: =VLOOKUP($L84,[summary.xls]MASTER!$F$8:$BF$88,51,TRUE) ->  | AC84: =VLOOKUP($L84,[summary.xls]MASTER!$F$8:$BF$88,52,TRUE) ->  | AD84: =VLOOKUP($L84,[summary.xls]MASTER!$F$8:$BF$88,53,TRUE) -> 
K85: =RANK(N85,$N$18:$N$98,0) -> 68 | L85: Maria | N85: =[summary.xls]Maria!$E$173 -> 64 | O85: =[summary.xls]Maria!$F$69 -> 41 | P85: =[summary.xls]Maria!$F$148 -> 18 | Q85: =[summary.xls]Maria!$F$168 -> 5 | R85: 0 | T85: =VLOOKUP($L85,[summary.xls]MASTER!$F$8:$BF$88,46,TRUE) ->  | U85: =VLOOKUP($L85,[summary.xls]MASTER!$F$8:$BF$88,47,TRUE) ->  | W85: =VLOOKUP($L85,[summary.xls]MASTER!$F$8:$BF$88,48,TRUE) ->  | X85: =VLOOKUP($L85,[summary.xls]MASTER!$F$8:$BF$88,49,TRUE) ->  | Z85: =VLOOKUP($L85,[summary.xls]MASTER!$F$8:$BF$88,50,TRUE) ->  | AA85: =VLOOKUP($L85,[summary.xls]MASTER!$F$8:$BF$88,51,TRUE) ->  | AC85: =VLOOKUP($L85,[summary.xls]MASTER!$F$8:$BF$88,52,TRUE) ->  | AD85: =VLOOKUP($L85,[summary.xls]MASTER!$F$8:$BF$88,53,TRUE) -> 
K86: =RANK(N86,$N$18:$N$98,0) -> 68 | L86: Jeannette | N86: =[summary.xls]Jeannette!$E$173 -> 64 | O86: =[summary.xls]Jeannette!$F$69 -> 35 | P86: =[summary.xls]Jeannette!$F$148 -> 19 | Q86: =[summary.xls]Jeannette!$F$168 -> 10 | R86: 0 | T86: =VLOOKUP($L86,[summary.xls]MASTER!$F$8:$BF$88,46,TRUE) ->  | U86: =VLOOKUP($L86,[summary.xls]MASTER!$F$8:$BF$88,47,TRUE) ->  | W86: =VLOOKUP($L86,[summary.xls]MASTER!$F$8:$BF$88,48,TRUE) ->  | X86: =VLOOKUP($L86,[summary.xls]MASTER!$F$8:$BF$88,49,TRUE) ->  | Z86: =VLOOKUP($L86,[summary.xls]MASTER!$F$8:$BF$88,50,TRUE) ->  | AA86: =VLOOKUP($L86,[summary.xls]MASTER!$F$8:$BF$88,51,TRUE) ->  | AC86: =VLOOKUP($L86,[summary.xls]MASTER!$F$8:$BF$88,52,TRUE) ->  | AD86: =VLOOKUP($L86,[summary.xls]MASTER!$F$8:$BF$88,53,TRUE) -> 
K87: =RANK(N87,$N$18:$N$98,0) -> 68 | L87: Danny2 | N87: =[summary.xls]Danny2!$E$173 -> 64 | O87: =[summary.xls]Danny2!$F$69 -> 27 | P87: =[summary.xls]Danny2!$F$148 -> 37 | Q87: =[summary.xls]Danny2!$F$168 -> 0 | R87: 0 | T87: =VLOOKUP($L87,[summary.xls]MASTER!$F$8:$BF$88,46,TRUE) ->  | U87: =VLOOKUP($L87,[summary.xls]MASTER!$F$8:$BF$88,47,TRUE) ->  | Z87: =VLOOKUP($L87,[summary.xls]MASTER!$F$8:$BF$88,50,TRUE) ->  | AA87: =VLOOKUP($L87,[summary.xls]MASTER!$F$8:$BF$88,51,TRUE) ->  | AC87: =VLOOKUP($L87,[summary.xls]MASTER!$F$8:$BF$88,52,TRUE) ->  | AD87: =VLOOKUP($L87,[summary.xls]MASTER!$F$8:$BF$88,53,TRUE) -> 
K88: =RANK(N88,$N$18:$N$98,0) -> 71 | L88: Doug | N88: =[summary.xls]Doug!$E$173 -> 63 | O88: =[summary.xls]Doug!$F$69 -> 37 | P88: =[summary.xls]Doug!$F$148 -> 21 | Q88: =[summary.xls]Doug!$F$168 -> 5 | R88: 0 | T88: =VLOOKUP($L88,[summary.xls]MASTER!$F$8:$BF$88,46,TRUE) ->  | U88: =VLOOKUP($L88,[summary.xls]MASTER!$F$8:$BF$88,47,TRUE) ->  | W88: =VLOOKUP($L88,[summary.xls]MASTER!$F$8:$BF$88,48,TRUE) ->  | X88: =VLOOKUP($L88,[summary.xls]MASTER!$F$8:$BF$88,49,TRUE) ->  | Z88: =VLOOKUP($L88,[summary.xls]MASTER!$F$8:$BF$88,50,TRUE) ->  | AA88: =VLOOKUP($L88,[summary.xls]MASTER!$F$8:$BF$88,51,TRUE) ->  | AC88: =VLOOKUP($L88,[summary.xls]MASTER!$F$8:$BF$88,52,TRUE) ->  | AD88: =VLOOKUP($L88,[summary.xls]MASTER!$F$8:$BF$88,53,TRUE) -> 
K89: =RANK(N89,$N$18:$N$98,0) -> 71 | L89: GeorgeD1 | N89: =[summary.xls]GeorgeD1!$E$173 -> 63 | O89: =[summary.xls]GeorgeD1!$F$69 -> 35 | P89: =[summary.xls]GeorgeD1!$F$148 -> 23 | Q89: =[summary.xls]GeorgeD1!$F$168 -> 5 | R89: 0 | T89: =VLOOKUP($L89,[summary.xls]MASTER!$F$8:$BF$88,46,TRUE) ->  | U89: =VLOOKUP($L89,[summary.xls]MASTER!$F$8:$BF$88,47,TRUE) ->  | W89: =VLOOKUP($L89,[summary.xls]MASTER!$F$8:$BF$88,48,TRUE) ->  | X89: =VLOOKUP($L89,[summary.xls]MASTER!$F$8:$BF$88,49,TRUE) ->  | Z89: =VLOOKUP($L89,[summary.xls]MASTER!$F$8:$BF$88,50,TRUE) ->  | AA89: =VLOOKUP($L89,[summary.xls]MASTER!$F$8:$BF$88,51,TRUE) ->  | AC89: =VLOOKUP($L89,[summary.xls]MASTER!$F$8:$BF$88,52,TRUE) ->  | AD89: =VLOOKUP($L89,[summary.xls]MASTER!$F$8:$BF$88,53,TRUE) -> 
K90: =RANK(N90,$N$18:$N$98,0) -> 73 | L90: MarceloJr | N90: =[summary.xls]MarceloJr!$E$173 -> 62 | O90: =[summary.xls]MarceloJr!$F$69 -> 35 | P90: =[summary.xls]MarceloJr!$F$148 -> 22 | Q90: =[summary.xls]MarceloJr!$F$168 -> 5 | R90: 0 | T90: =VLOOKUP($L90,[summary.xls]MASTER!$F$8:$BF$88,46,TRUE) ->  | U90: =VLOOKUP($L90,[summary.xls]MASTER!$F$8:$BF$88,47,TRUE) ->  | W90: =VLOOKUP($L90,[summary.xls]MASTER!$F$8:$BF$88,48,TRUE) ->  | X90: =VLOOKUP($L90,[summary.xls]MASTER!$F$8:$BF$88,49,TRUE) ->  | Z90: =VLOOKUP($L90,[summary.xls]MASTER!$F$8:$BF$88,50,TRUE) ->  | AA90: =VLOOKUP($L90,[summary.xls]MASTER!$F$8:$BF$88,51,TRUE) ->  | AC90: =VLOOKUP($L90,[summary.xls]MASTER!$F$8:$BF$88,52,TRUE) ->  | AD90: =VLOOKUP($L90,[summary.xls]MASTER!$F$8:$BF$88,53,TRUE) -> 
K91: =RANK(N91,$N$18:$N$98,0) -> 73 | L91: Bert | N91: =[summary.xls]Bert!$E$173 -> 62 | O91: =[summary.xls]Bert!$F$69 -> 30 | P91: =[summary.xls]Bert!$F$148 -> 27 | Q91: =[summary.xls]Bert!$F$168 -> 5 | R91: 0 | T91: =VLOOKUP($L91,[summary.xls]MASTER!$F$8:$BF$88,46,TRUE) ->  | U91: =VLOOKUP($L91,[summary.xls]MASTER!$F$8:$BF$88,47,TRUE) ->  | Z91: =VLOOKUP($L91,[summary.xls]MASTER!$F$8:$BF$88,50,TRUE) ->  | AA91: =VLOOKUP($L91,[summary.xls]MASTER!$F$8:$BF$88,51,TRUE) ->  | AC91: =VLOOKUP($L91,[summary.xls]MASTER!$F$8:$BF$88,52,TRUE) ->  | AD91: =VLOOKUP($L91,[summary.xls]MASTER!$F$8:$BF$88,53,TRUE) -> 
K92: =RANK(N92,$N$18:$N$98,0) -> 73 | L92: Charlene | N92: =[summary.xls]Charlene!$E$173 -> 62 | O92: =[summary.xls]Charlene!$F$69 -> 30 | P92: =[summary.xls]Charlene!$F$148 -> 27 | Q92: =[summary.xls]Charlene!$F$168 -> 5 | R92: 0 | T92: =VLOOKUP($L92,[summary.xls]MASTER!$F$8:$BF$88,46,TRUE) ->  | U92: =VLOOKUP($L92,[summary.xls]MASTER!$F$8:$BF$88,47,TRUE) ->  | Z92: =VLOOKUP($L92,[summary.xls]MASTER!$F$8:$BF$88,50,TRUE) ->  | AA92: =VLOOKUP($L92,[summary.xls]MASTER!$F$8:$BF$88,51,TRUE) ->  | AC92: =VLOOKUP($L92,[summary.xls]MASTER!$F$8:$BF$88,52,TRUE) ->  | AD92: =VLOOKUP($L92,[summary.xls]MASTER!$F$8:$BF$88,53,TRUE) -> 
K93: =RANK(N93,$N$18:$N$98,0) -> 73 | L93: DarrylJ | N93: =[summary.xls]DarrylJ!$E$173 -> 62 | O93: =[summary.xls]DarrylJ!$F$69 -> 30 | P93: =[summary.xls]DarrylJ!$F$148 -> 27 | Q93: =[summary.xls]DarrylJ!$F$168 -> 5 | R93: 0 | T93: =VLOOKUP($L93,[summary.xls]MASTER!$F$8:$BF$88,46,TRUE) ->  | U93: =VLOOKUP($L93,[summary.xls]MASTER!$F$8:$BF$88,47,TRUE) ->  | Z93: =VLOOKUP($L93,[summary.xls]MASTER!$F$8:$BF$88,50,TRUE) ->  | AA93: =VLOOKUP($L93,[summary.xls]MASTER!$F$8:$BF$88,51,TRUE) ->  | AC93: =VLOOKUP($L93,[summary.xls]MASTER!$F$8:$BF$88,52,TRUE) ->  | AD93: =VLOOKUP($L93,[summary.xls]MASTER!$F$8:$BF$88,53,TRUE) -> 
K94: =RANK(N94,$N$18:$N$98,0) -> 77 | L94: GeorgeD2 | N94: =[summary.xls]GeorgeD2!$E$173 -> 60 | O94: =[summary.xls]GeorgeD2!$F$69 -> 33 | P94: =[summary.xls]GeorgeD2!$F$148 -> 27 | Q94: =[summary.xls]GeorgeD2!$F$168 -> 0 | R94: =[summary.xls]GeorgeD2!$L$1 -> 0 | T94: =VLOOKUP($L94,[summary.xls]MASTER!$F$8:$BF$88,46,TRUE) ->  | U94: =VLOOKUP($L94,[summary.xls]MASTER!$F$8:$BF$88,47,TRUE) ->  | W94: =VLOOKUP($L94,[summary.xls]MASTER!$F$8:$BF$88,48,TRUE) ->  | X94: =VLOOKUP($L94,[summary.xls]MASTER!$F$8:$BF$88,49,TRUE) ->  | Z94: =VLOOKUP($L94,[summary.xls]MASTER!$F$8:$BF$88,50,TRUE) ->  | AA94: =VLOOKUP($L94,[summary.xls]MASTER!$F$8:$BF$88,51,TRUE) ->  | AC94: =VLOOKUP($L94,[summary.xls]MASTER!$F$8:$BF$88,52,TRUE) ->  | AD94: =VLOOKUP($L94,[summary.xls]MASTER!$F$8:$BF$88,53,TRUE) -> 
K95: =RANK(N95,$N$18:$N$98,0) -> 78 | L95: Frank | N95: =[summary.xls]Frank!$E$173 -> 59 | O95: =[summary.xls]Frank!$F$69 -> 35 | P95: =[summary.xls]Frank!$F$148 -> 24 | Q95: =[summary.xls]Frank!$F$168 -> 0 | R95: =[summary.xls]Frank!$L$1 -> 0 | T95: =VLOOKUP($L95,[summary.xls]MASTER!$F$8:$BF$88,46,TRUE) ->  | U95: =VLOOKUP($L95,[summary.xls]MASTER!$F$8:$BF$88,47,TRUE) ->  | W95: =VLOOKUP($L95,[summary.xls]MASTER!$F$8:$BF$88,48,TRUE) ->  | X95: =VLOOKUP($L95,[summary.xls]MASTER!$F$8:$BF$88,49,TRUE) ->  | Z95: =VLOOKUP($L95,[summary.xls]MASTER!$F$8:$BF$88,50,TRUE) ->  | AA95: =VLOOKUP($L95,[summary.xls]MASTER!$F$8:$BF$88,51,TRUE) ->  | AC95: =VLOOKUP($L95,[summary.xls]MASTER!$F$8:$BF$88,52,TRUE) ->  | AD95: =VLOOKUP($L95,[summary.xls]MASTER!$F$8:$BF$88,53,TRUE) -> 
K96: =RANK(N96,$N$18:$N$98,0) -> 79 | L96: Andrea | N96: =[summary.xls]Andrea!$E$173 -> 55 | O96: =[summary.xls]Andrea!$F$69 -> 31 | P96: =[summary.xls]Andrea!$F$148 -> 19 | Q96: =[summary.xls]Andrea!$F$168 -> 5 | R96: =[summary.xls]Andrea!$L$1 -> 0 | T96: =VLOOKUP($L96,[summary.xls]MASTER!$F$8:$BF$88,46,TRUE) ->  | U96: =VLOOKUP($L96,[summary.xls]MASTER!$F$8:$BF$88,47,TRUE) ->  | W96: =VLOOKUP($L96,[summary.xls]MASTER!$F$8:$BF$88,48,TRUE) ->  | X96: =VLOOKUP($L96,[summary.xls]MASTER!$F$8:$BF$88,49,TRUE) ->  | Z96: =VLOOKUP($L96,[summary.xls]MASTER!$F$8:$BF$88,50,TRUE) ->  | AA96: =VLOOKUP($L96,[summary.xls]MASTER!$F$8:$BF$88,51,TRUE) ->  | AC96: =VLOOKUP($L96,[summary.xls]MASTER!$F$8:$BF$88,52,TRUE) ->  | AD96: =VLOOKUP($L96,[summary.xls]MASTER!$F$8:$BF$88,53,TRUE) -> 
K97: =RANK(N97,$N$18:$N$98,0) -> 80 | L97: Mike | N97: =[summary.xls]Mike!$E$173 -> 50 | O97: =[summary.xls]Mike!$F$69 -> 30 | P97: =[summary.xls]Mike!$F$148 -> 20 | Q97: =[summary.xls]Mike!$F$168 -> 0 | R97: =[summary.xls]Mike!$L$1 -> 0 | T97: =VLOOKUP($L97,[summary.xls]MASTER!$F$8:$BF$88,46,TRUE) ->  | U97: =VLOOKUP($L97,[summary.xls]MASTER!$F$8:$BF$88,47,TRUE) ->  | W97: =VLOOKUP($L97,[summary.xls]MASTER!$F$8:$BF$88,48,TRUE) ->  | X97: =VLOOKUP($L97,[summary.xls]MASTER!$F$8:$BF$88,49,TRUE) ->  | Z97: =VLOOKUP($L97,[summary.xls]MASTER!$F$8:$BF$88,50,TRUE) ->  | AA97: =VLOOKUP($L97,[summary.xls]MASTER!$F$8:$BF$88,51,TRUE) ->  | AC97: =VLOOKUP($L97,[summary.xls]MASTER!$F$8:$BF$88,52,TRUE) ->  | AD97: =VLOOKUP($L97,[summary.xls]MASTER!$F$8:$BF$88,53,TRUE) -> 
K98: =RANK(N98,$N$18:$N$98,0) -> 80 | L98: Vince | N98: =[summary.xls]Vince!$E$173 -> 50 | O98: =[summary.xls]Vince!$F$69 -> 28 | P98: =[summary.xls]Vince!$F$148 -> 12 | Q98: =[summary.xls]Vince!$F$168 -> 10 | R98: =[summary.xls]Vince!$L$1 -> 0 | T98: =VLOOKUP($L98,[summary.xls]MASTER!$F$8:$BF$88,46,TRUE) ->  | U98: =VLOOKUP($L98,[summary.xls]MASTER!$F$8:$BF$88,47,TRUE) ->  | W98: =VLOOKUP($L98,[summary.xls]MASTER!$F$8:$BF$88,48,TRUE) ->  | X98: =VLOOKUP($L98,[summary.xls]MASTER!$F$8:$BF$88,49,TRUE) ->  | Z98: =VLOOKUP($L98,[summary.xls]MASTER!$F$8:$BF$88,50,TRUE) ->  | AA98: =VLOOKUP($L98,[summary.xls]MASTER!$F$8:$BF$88,51,TRUE) ->  | AC98: =VLOOKUP($L98,[summary.xls]MASTER!$F$8:$BF$88,52,TRUE) ->  | AD98: =VLOOKUP($L98,[summary.xls]MASTER!$F$8:$BF$88,53,TRUE) -> 

A1: STANDINGS